Idiom,Meaning
가갸 뒷다리[뒤 자]도 모른다,"반절본문의 첫 글자인 ‘가’와 ‘갸’의 세로획조차도 쓸 줄 모른다는 뜻으로, 글자를 전혀 깨치지 못하여 무식하거나, 사리에 몹시 어두운 사람을 놀림조로 이르는 말. "
가게 기둥에 입춘[주련],"추하고 보잘것없는 가겟집 기둥에 ‘입춘대길’이라 써 붙인다는 뜻으로, 제격에 맞지 않음을 비유적으로 이르는 말. "
가까운 남이 먼 일가보다 낫다,이웃끼리 서로 친하게 지내다 보면 먼 곳에 있는 일가보다 더 친하게 되어 서로 도우며 살게 된다는 것을 이르는 말. 
가까운 데를 가도 점심밥을 싸 가지고 가거라,"십 리밖에 안 되는 가까운 데를 가더라도 점심밥을 싸 가지고 다닌다는 뜻으로, 무슨 일에나 준비를 든든히 할 것을 비유적으로 이르는 말. "
가까운 데 집은 깎이고 먼 데 절[집]은 비친다,"가까운 데 있는 절이나 집은 자잘한 흠도 잘 드러나서 좋지 않아 보이고 먼 곳에 윤곽만 보이는 절이나 집은 좋아 보인다는 뜻으로, 늘 가까이에 있는 것은 그 뛰어남이 보이지 않는 반면 멀리 있는 것은 실제보다 더 돋보이기 쉬움을 비유적으로 이르는 말. "
가까운 무당보다 먼 데 무당이 영하다,흔히 사람은 자신이 잘 알고 가까이 있는 것보다는 잘 모르고 멀리 있는 것을 더 좋은 것인 줄로 생각한다는 말. 
가까운 집 며느리일수록 흉이 많다,늘 가까이 있고 잘 아는 사이일수록 상대편의 결점이 눈에 더 많이 띈다는 말. 
가꾸로 박히다,머리를 땅으로 향한 채 떨어지다. 
가난들다,「1」가난하게 되다. 「2」필요하거나 쓸 만한 것이 드물어 구하기 어렵게 되다. 「3」농작물의 수확이 여느 해보다 아주 적게 되다. 
가난 구제는 나라[나라님/임금]도 못한다[어렵다],"남의 가난한 살림을 도와주기란 끝이 없는 일이어서, 개인은 물론 나라의 힘으로도 구제하지 못한다는 말. "
가난 구제는 지옥 늧이라,"가난한 사람을 구제하는 것은 지옥에 떨어질 징조라는 뜻으로, 그 일이 결국에 가서는 자신에게 해롭게 되고 고생거리가 되니 아예 가난한 사람을 구제할 생각도 하지 말라는 것을 비유적으로 이르는 말. "
가난도 비단 가난,"아무리 가난하여도 몸을 함부로 가지지 않고, 본래의 지체와 체통을 더럽히지 않는다는 말. "
가난은 나라 못 당한다,"남의 가난한 살림을 도와주기란 끝이 없는 일이어서, 개인은 물론 나라의 힘으로도 구제하지 못한다는 말. "
가난이 소 아들이라,소처럼 죽도록 일해도 가난에서 벗어날 수 없음을 이르는 말. 
가난이 싸움이다,"모든 싸움의 원인이 가난에 있다는 뜻으로, 가난하면 작은 이해를 놓고도 자연히 서로 다투게 되어 불화가 된다는 말. "
가난이 원수,가난하기 때문에 억울한 경우나 고통을 당하게 되니 가난이 원수같이 느껴진다는 말. 
가난이 죄다,"가난하기 때문에 여러 가지 범죄를 저지르거나, 불행과 고통을 당하게 된다는 말. "
가난이 질기다,"가난하여 곧 굶어 죽을 것 같으나 잘 견디어 낸다는 뜻으로, 가난 속에서도 갖은 고생을 하며 그럭저럭 살아감을 비유적으로 이르는 말. "
가난이 파고들다,더욱더 가난해지다. 
가난한 상주 방갓 대가리 같다,"「1」사람의 몰골이 허술하여 볼품없어 보임을 놀림조로 이르는 말. 「2」무슨 물건이 탐탁하지 못하고 어색해 보이며 값없어 보임을 이르는 말. 「3」머리가 모시처럼 희게 되었다는 뜻으로, 오랜 세월이 지났다는 말. "
가난한 양반 씻나락 주무르듯,"가난한 양반이 털어먹자니 앞날이 걱정스럽고 그냥 두자니 당장 굶는 일이 걱정되어서 볍씨만 한없이 주무르고 있다는 뜻으로, 어떤 일에 닥쳐 우물쭈물하기만 하면서 선뜻 결정을 내리지 못하고 있는 모양을 이르는 말. "
가난한 양반 향청에 들어가듯,"「1」가난한 양반이 주눅이 들어 향청에 들어갈 때처럼, 행색이 떳떳하지 못하고 머뭇거리면서 쩔쩔매는 모습을 비유적으로 이르는 말. 「2」하기 싫은 일을 마지못하여 기운 없이 함을 비유적으로 이르는 말. "
가난한 집 신주 굶듯,"가난한 집에서는 산 사람도 배를 곯는 형편이므로 신주까지도 제사 음식을 제대로 받아 보지 못하게 된다는 뜻으로, 줄곧 굶기만 한다는 말. "
가난한 집에 자식이 많다,"가난한 집에는 먹고 살아 나갈 걱정이 큰데 자식까지 많다는 뜻으로, 이래저래 부담되는 것이 많음을 이르는 말. "
가난한 집 제사[제삿날/젯날] 돌아오듯,"살아가기도 어려운 가난한 집에 제삿날이 자꾸 돌아와서 그것을 치르느라 매우 어려움을 겪는다는 뜻으로, 힘든 일이 자주 닥쳐옴을 비유적으로 이르는 말. "
가난할수록 기와집 짓는다,"「1」당장 먹을 것이나 입을 것이 넉넉지 못한 가난한 살림일수록 기와집을 짓는다는 뜻으로, 실상은 가난한 사람이 남에게 업신여김을 당하기 싫어서 허세를 부리려는 심리를 비유적으로 이르는 말. 「2」가난하다고 주저앉고 마는 것이 아니라 어떻게든 잘살아 보려고 용단을 내어 큰일을 벌인다는 말. "
가는[가던] 날이 장날,"일을 보러 가니 공교롭게 장이 서는 날이라는 뜻으로, 어떤 일을 하려고 하는데 뜻하지 않은 일을 공교롭게 당함을 비유적으로 이르는 말. "
가는 날이 생일,"일을 보러 가니 공교롭게 생일이라는 뜻으로, 어떤 일을 하려고 하는데 뜻하지 않은 일을 공교롭게 당함을 비유적으로 이르는 말. "
가는 년이 물 길어다 놓고 갈까,이미 일이 다 틀어져 그만두는 터에 뒷일을 생각하고 돌아다볼 리 만무함을 비유적으로 이르는 말. 
가는 떡이 커야 오는 떡이 크다,자기가 남에게 말이나 행동을 좋게 하여야 남도 자기에게 좋게 한다는 말. 
가는 말에도 채찍을 치랬다,형편이나 힘이 한창 좋을 때라도 더욱 마음을 써서 힘써야 함을 비유적으로 이르는 말. 
가는 말에 채찍질,「1」열심히 하고 있는데도 더 빨리하라고 독촉함을 비유적으로 이르는 말. 「2」형편이나 힘이 한창 좋을 때라도 더욱 마음을 써서 힘써야 함을 비유적으로 이르는 말. 
가는 말이 고와야 오는 말이 곱다,자기가 남에게 말이나 행동을 좋게 하여야 남도 자기에게 좋게 한다는 말. 
가는 며느리가 보리방아 찧어 놓고 가랴,이미 일이 다 틀어져 그만두는 터에 뒷일을 생각하고 돌아다볼 리 만무함을 비유적으로 이르는 말. 
가는 방망이 오는 홍두깨,"「1」이쪽에서 방망이로 저쪽을 때리면 저쪽에서는 홍두깨로 이쪽을 때린다는 뜻으로, 자기가 한 일보다 더 가혹한 갚음을 받게 되는 경우를 비유적으로 이르는 말. 「2」남을 해치려고 하다가 제가 도리어 더 큰 화를 입게 됨을 비유적으로 이르는 말. "
가는베 낳겠다,"가늘고 고운 베를 잘도 짜겠다는 뜻으로, 솜씨가 없고 무딤을 비웃는 말. "
가는 세월 오는 백발,세월이 가면 나이를 먹고 늙는다는 말. 
가는 손님은 뒤꼭지가 예쁘다,손님 대접하기가 어려운 터에 손님이 속을 알아주어 빨리 돌아가니 고맙게 여긴다는 것을 비유적으로 이르는 말. 
가는 정이 있어야 오는 정이 있다,자기가 남에게 말이나 행동을 좋게 하여야 남도 자기에게 좋게 한다는 말. 
가는 토끼 잡으려다 잡은 토끼 놓친다,"다른 토끼도 잡겠다고 욕심을 부리던 나머지 잡은 토끼를 잘못 간수한 탓으로 놓친다는 뜻으로, 지나치게 욕심을 부리다가 이미 차지한 것까지 잃어버리게 됨을 비유적으로 이르는 말. "
가늘게 먹고 가는 똥 싸라,너무 욕심을 부리다가는 봉변을 당하기 쉬우니 제힘에 맞게 적당히 취하라는 것을 비유적으로 이르는 말. 
가늘게 먹고 가늘게 살아라,"검소하게 먹으면서 소박하게 살라는 뜻으로, 분수에 맞지 않게 호화로운 생활을 추구하거나 분에 넘치는 행동을 하지 말라는 것을 비유적으로 이르는 말. "
가늠보다,「1」목표를 겨누어 보다. 「2」형편이나 시세 따위를 살피다. 「3」물건의 무게를 달 때에 저울눈이 바른지 아니한지를 보다. 
가늠잡다,「1」목표를 겨누어 보다. 「2」형편이나 시세 따위를 살피다. 「3」물건의 무게를 달 때에 저울눈이 바른지 아니한지를 보다. 
가늠이 가다,짐작이나 헤아림이 이루어지거나 미치다. 
가닥을 잡다,"분위기, 상황, 생각 따위를 이치나 논리에 따라 바로잡다. "
가닥이 잡히다,"분위기, 상황, 생각 따위가 이치나 논리에 따라 바로잡히다. "
가도 오도 못하다,한곳에서 자리를 옮기거나 움직일 수 없는 상태가 되다. 
가락떼다,「1」흥이 나는 일에 첫 동작을 실행하다. 「2」풍류를 치다. 
가락나다,일하는 기운이나 능률이 오르다. 
가락맞다,「1」율동이나 장단이 잘 어울리다. 「2」행동이 서로 잘 들어맞다. 
가락꼬치 아니면 송곳,"날카로워서 잘 꿰뚫는다는 뜻으로, 판단이 아주 정확함을 비유적으로 이르는 말. "
가락 바로잡는 집에 가져다가 세워 놨다 와도 좀 낫다,"휜 물렛가락을 가락 고치는 집에 가져다 놓았다가 다시 가져오기만 하여도 휜 것이 바로잡힌 것처럼 느껴진다는 뜻으로, 좋은 환경의 영향을 조금만 받아도 정신적으로 위안이 됨을 비유적으로 이르는 말. "
가락을 내다,"윷놀이를 할 때, 윷가락을 잘 던져서 원하는 대로 엎기도 하고 잦히기도 한다. "
가락을 받다,「1」가락을 따라서 치다. 「2」남의 소리나 노래의 뒤를 이어 부르다. 
가랑니가 더 문다,같잖고 시시한 것이 더 괴롭히거나 애를 먹임을 비유적으로 이르는 말. 
가랑비에 옷 젖는 줄 모른다,"가늘게 내리는 비는 조금씩 젖어 들기 때문에 여간해서도 옷이 젖는 줄을 깨닫지 못한다는 뜻으로, 아무리 사소한 것이라도 그것이 거듭되면 무시하지 못할 정도로 크게 됨을 비유적으로 이르는 말. "
가랑이찢어지다[째지다],「1」몹시 가난한 살림살이를 비유적으로 이르는 말. 「2」(비유적으로) 하는 일이 힘에 부치거나 일손이 부족하여 일해 나가기가 몹시 벅차다. 
가랑잎에 불붙듯[달리듯],"「1」바싹 마른 가랑잎에 불을 지르면 걷잡을 수 없이 잘 탄다는 뜻으로, 성미가 조급하고 도량이 좁아 걸핏하면 발끈하고 화를 잘 내는 것을 비유적으로 이르는 말. 「2」어떤 주장에 호응하거나, 자극에 대하여 빠르게 반응함을 비유적으로 이르는 말. "
가랑잎으로 눈가리고 아웅 한다,얕은수로 남을 속이려 한다는 말. 
가랑잎으로 눈 가리기,「1」자기의 존재나 허물을 숨기려고 미련하게 애쓰는 경우를 비유적으로 이르는 말. 「2」미련하여 아무리 애써도 제대로 일 처리를 하지 못함을 비유적으로 이르는 말. 
가랑잎으로 똥 싸 먹겠다,잘살던 사람이 별안간 몹시 가난해져서 어찌할 수 없는 신세가 됨을 비유적으로 이르는 말. 
가랑잎이 솔잎더러 바스락거린다고 한다,"더 바스락거리는 가랑잎이 솔잎더러 바스락거린다고 나무란다는 뜻으로, 자기의 허물은 생각하지 않고 도리어 남의 허물만 나무라는 경우를 비유적으로 이르는 말. "
가래 터 종놈 같다,"힘든 가래질을 억지로 하는 종과 같다는 뜻으로, 성품이 거칠고 버릇없이 굴거나 매사에 못마땅해서 무뚝뚝하게 구는 사람을 비유적으로 이르는 말. "
가려운 곳을[데를] 긁어 주듯[주다],남에게 꼭 필요한 것을 잘 알아서 그 욕구를 시원스럽게 만족시켜 줌을 비유적으로 이르는 말. 
가로 뛰고 세로 뛰다,감정이 북받쳐 이리저리 날뛰다. 
가로 지나 세로 지나,"짐을 가로로 지나 세로로 지나 등에 지기는 마찬가지라는 뜻으로, 이렇게 되든지 저렇게 되든지 마찬가지인 경우를 비유적으로 이르는 말. "
가루 가지고 떡 못 만들랴,"가루만 있으면 누구나 떡을 만들 수 있다는 뜻으로, 누구나 다 할 수 있는 일을 자랑하며 뽐내는 것을 비웃는 말. "
가루는 칠수록 고와지고 말은 할수록 거칠어진다,가루는 체에 칠수록 고와지지만 말은 길어질수록 시비가 붙을 수 있고 마침내는 말다툼까지 가게 되니 말을 삼가라는 말. 
가루 팔러 가니 바람이 불고 소금 팔러 가니 이슬비 온다,"가루 장사를 가면 바람이 불어 가루를 날리고 소금 장사를 가면 이슬비가 와서 소금을 다 녹여 버린다는 뜻으로, 일이 뜻대로 되지 않고 엇나감을 비유적으로 이르는 말. "
가리틀다,「1」잘되어 가는 일을 안되도록 방해하다. 「2」남의 횡재에 대하여 무리하게 한몫을 청하다. 
가림은 있어야 의복이라 한다,"가려야 할 데를 가려야 비로소 의복이라 할 수 있다는 뜻으로, 제가 맡은 구실을 온전히 다 해야만 그에 마땅한 대우를 받음을 비유적으로 이르는 말. "
가마가 검기로 밥도 검을까,"가마가 검다고 하여 가마 안의 밥까지 검겠느냐는 뜻으로, 겉이 좋지 않다고 하여 속도 좋지 않을 것이라고 경솔하게 판단하지 말라는 말. "
가마가 많으면 모든 것이 헤프다,"가마가 많으면 그만큼 여러 곳에 나누어 넣고 끓이게 되므로 모든 것이 헤프다는 뜻으로, 일이나 살림을 여기저기 벌여 놓으면 결국 낭비가 많아진다는 말. "
가마가 솥더러 검정아 한다,"더 시꺼먼 가마솥 밑이 덜 시꺼먼 노구솥 밑을 보고 도리어 검다고 흉본다는 뜻으로, 남 못지않은 잘못이나 결함이 있는 사람이 제 흉은 모르고 남의 잘못이나 결함만을 흉봄을 비유적으로 이르는 말. "
가마를 태우다,그럴듯하게 추어올려 얼렁뚱땅 넘어가거나 속여 넘기다. 
가마 밑이 노구솥 밑을 검다 한다,"더 시꺼먼 가마솥 밑이 덜 시꺼먼 노구솥 밑을 보고 도리어 검다고 흉본다는 뜻으로, 남 못지않은 잘못이나 결함이 있는 사람이 제 흉은 모르고 남의 잘못이나 결함만을 흉봄을 비유적으로 이르는 말. "
가마 속의 콩도 삶아야 먹는다,"가마 안에 들어간 콩도 끓여서 삶아야 먹을 수 있다는 뜻으로, 다 된 듯하고 쉬운 일이라도 손을 대어 힘을 들이지 않으면 이익이 되지 않음을 비유적으로 이르는 말. "
가마솥 밑이 노구솥 밑을 검다 한다,"더 시꺼먼 가마솥 밑이 덜 시꺼먼 노구솥 밑을 보고 도리어 검다고 흉본다는 뜻으로, 남 못지않은 잘못이나 결함이 있는 사람이 제 흉은 모르고 남의 잘못이나 결함만을 흉봄을 비유적으로 이르는 말. "
가마솥에 든 고기,꼼짝없이 죽게 된 신세를 비유적으로 이르는 말. 
가마솥이 검기로 밥도 검을까,"가마가 검다고 하여 가마 안의 밥까지 검겠느냐는 뜻으로, 겉이 좋지 않다고 하여 속도 좋지 않을 것이라고 경솔하게 판단하지 말라는 말. "
가마 안의 팥이 풀어져도 그 안에 있다,손해를 본 것 같지만 따지고 보면 손해를 본 것이 없음을 비유적으로 이르는 말. 
가마 타고 시집가기는 틀렸다,"시집을 갈 때 으레 가마를 타고 가는 것이나 그 격식을 좇아서 하지 못한다는 뜻으로, 일이 제대로 되지 않아 격식과 채비를 갖추어서 하기는 틀렸음을 비유적으로 이르는 말. "
가마 타고 시집가기는 콧집이 앙그러졌다,"시집을 갈 때 으레 가마를 타고 가는 것이나 그 격식을 좇아서 하지 못한다는 뜻으로, 일이 제대로 되지 않아 격식과 채비를 갖추어서 하기는 틀렸음을 비유적으로 이르는 말. "
가마 타고 옷고름 단다,미리 준비를 해 놓지 않아서 임박해서야 허둥지둥하게 되는 경우를 비유적으로 이르는 말. 
가만한 바람이 대목을 꺾는다,"약하게 가만가만 부는 바람이 큰 나무를 꺾는다는 뜻으로, 작고 약한 것이라고 얕잡아 보아서는 안 된다는 말. "
가만히 먹으라니까 뜨겁다 한다,「1」어긋나는 짓을 함을 비유적으로 이르는 말. 「2」남의 약점을 알고 더욱 난처하게 하는 경우를 비유적으로 이르는 말. 
가면벗다,거짓으로 꾸민 모습을 버리고 정체를 드러내다. 
가면쓰다,본심을 감추고 겉으로는 그렇지 않은 것처럼 꾸미다. 
가면을 벗기다,거짓으로 꾸민 정체를 밝히다. 
가문 날에 빗방울 안 떨어지는 날이 없다,가뭄이 계속되면서 비는 시원히 오지 않고 몇 방울 떨어지기만 한다는 말. 
가문 논에 물 대기,일이 매우 힘들거나 힘들여 해 놓아도 성과가 없는 경우를 이르는 말. 
가문 덕에 대접받는다,변변치 못한 사람이 좋은 가문에 태어난 덕분에 좋은 대우를 받는다는 말. 
가문을 흐리다,집안이나 문중의 명예를 더럽히다. 
가물 그루터기는 있어도 장마 그루터기는 없다,"가뭄은 아무리 심하여도 얼마간의 거둘 것이 있지만 큰 장마가 진 뒤에는 아무것도 거둘 것이 없다는 뜻으로, 가뭄에 의한 재난보다 장마로 인한 재난이 더 무서움을 비유적으로 이르는 말. "
가물 끝은 있어도 장마 끝은 없다,"가뭄은 아무리 심하여도 얼마간의 거둘 것이 있지만 큰 장마가 진 뒤에는 아무것도 거둘 것이 없다는 뜻으로, 가뭄에 의한 재난보다 장마로 인한 재난이 더 무서움을 비유적으로 이르는 말. "
가물에 단비,"가뭄이 들어 곡식이 다 마를 때에 기다리던 비가 온다는 뜻으로, 기다리고 바라던 일이 마침내 이루어짐을 이르는 말. "
가물에 돌 친다,"물이 없는 가뭄에 도랑을 미리 쳐서 물길을 낸다는 뜻으로, 무슨 일이든지 사전에 미리 준비를 해야 함을 비유적으로 이르는 말. "
가물에 콩나듯,"가뭄에는 심은 콩이 제대로 싹이 트지 못하여 드문드문 난다는 뜻으로, 어떤 일이나 물건이 어쩌다 하나씩 드문드문 있는 경우를 비유적으로 이르는 말. "
가뭄철 물웅덩이의 올챙이 신세,"가뭄으로 말라 버려 곧 밑바닥이 드러나고야 말 물웅덩이 속에서 우글거리는 올챙이 신세라는 뜻으로, 머지않아 죽거나 파멸할 운명에 놓인 가련한 신세를 비유적으로 이르는 말. "
가방끈길다,많이 배워 학력이 높다. 
가방끈짧다,많이 배우지 못해 학력이 낮다. 
가보 쪽 같은 양반,"노름에서 아홉 끗을 차지한 것과 같이 세상살이에서도 끗수를 가장 많이 차지한다는 뜻으로, 세도가 대단한 양반을 비유적으로 이르는 말. "
가살빼다,거만하게 가살스러운 태도를 짓다. 
가살쓰다,「1」경망스럽게 가살을 부리다. 「2」정신없고 부산스러운 행동을 하다. 
가슴앓다,안달하여 마음의 고통을 느끼다. 
가슴저미다,생각이나 느낌이 매우 심각하고 간절하여 가슴을 칼로 베는 듯한 아픔을 느끼게 하다. 
가슴치다,마음에 큰 충격을 받다. 
가슴태우다,몹시 애태우다. 
가슴펴다,굽힐 것 없이 당당하다. 
가슴에 멍이 들다[지다],마음속에 쓰라린 고통과 모진 슬픔이 지울 수 없이 맺히다. 
가슴에 불붙다,감정이 격해지다. 
가슴에 새기다,잊지 않게 단단히 마음에 기억하다. 
가슴에 손을 얹다,양심에 근거를 두다. 
가슴에 칼을 품다,상대편에게 모진 마음을 먹거나 흉악한 생각을 하다. 
가슴에 피멍들다,‘가슴에 멍이 들다[지다]’를 강조하여 이르는 말. 
가슴을 도려내다,마음을 아프게 하다. 
가슴을 뒤흔들다,마음을 들뜨게 하거나 설레게 하다. 
가슴을 불태우다,어떤 의욕이나 기세가 몹시 끓어오른 상태에서 활동하다. 
가슴을 열다,속마음을 털어놓거나 받아들이다. 
가슴을 짓찧다,마음에 몹시 심한 고통을 받다. 
가슴을 찢다,슬픔이나 분함 때문에 가슴이 째지는 듯한 고통을 주다. 
가슴을 헤쳐 놓다,마음속의 생각이나 말을 거리낌 없이 그대로 다 털어놓다. 
가슴이[가슴에] 찔리다,심한 양심의 가책을 받다. 
가슴이 넓다,이해심이 많다. 
가슴이 두방망이질하다,가슴이 몹시 세차게 두근거리다. 
가슴이 뜨겁다,깊고 큰 사랑과 배려를 받아 고마움으로 마음의 감동이 크다. 
가슴이 뜨끔하다,자극을 받아 마음이 깜짝 놀라거나 양심의 가책을 받다. 
가슴이 막히다,큰 기쁨이나 감격으로 마음속이 꽉 차다. 
가슴이 무겁다,슬픔이나 걱정으로 마음이 가라앉다. 
가슴이 무너져 내리다,심한 충격을 받아 마음을 다잡기 힘들게 되다. 
가슴이 미어지다,「1」마음이 슬픔이나 고통으로 가득 차 견디기 힘들게 되다. 「2」큰 기쁨이나 감격으로 마음속이 꽉 차다. 
가슴이 방망이질하다,심장이 몹시 두근거리다. 
가슴이 서늘하다,두려움으로 마음속에 찬 바람이 이는 것같이 선득하다. 
가슴이 숯등걸이 되다,애가 타서 마음이 상할 대로 상함을 비유적으로 이르는 말. 
가슴이 아리다,몹시 가엾거나 측은하여 마음이 알알하게 찌르는 것처럼 아프다. 
가슴이 좁다,이해심이 없다. 
가슴이 찢어지다,슬픔이나 분함 때문에 가슴이 째지는 듯한 고통을 받다. 
가슴이 콩알만 하다[해지다],불안하고 초조하여 마음을 펴지 못하고 있다. 
가슴이 타다,마음속으로 고민하여 가슴이 뜨거워지는 것 같다. 
가슴이 트이다,마음속에 맺힌 것이 풀리어 환해지다. 
가시돋다,공격의 의도나 불평불만이 있다. 
가시돋치다,‘가시(가) 돋다’를 강조하여 이르는 말. 
가시박히다,말속에 악의가 있다. 
가시세다,앙칼지고 고집이 세다. 
가시나무에 가시가 난다,모든 일은 근본에 따라 거기에 걸맞은 결과가 나타나는 것임을 비유적으로 이르는 말. 
가시나무에 연줄 걸리듯,「1」인정에 걸리어 이러지도 저러지도 못함을 비유적으로 이르는 말. 「2」친ㆍ인척 관계가 얼키설키 얽혀 있음을 비유적으로 이르는 말. 
가시 먹은 것 같다,남에게서 받거나 얻어먹은 것이 마음에 걸려 꺼림칙하다. 
가시 무서워 장 못 담그랴,다소 방해되는 것이 있다 하더라도 마땅히 할 일은 하여야 함을 비유적으로 이르는 말. 
가시밭길을 가다,힘겹고 험한 삶을 살다. 
가시아비 돈 떼어먹은 놈처럼,남에게 폐를 끼치고도 미안해하지 않는 태도를 비유적으로 이르는 말. 
가시어머니 장 떨어지자 사위 국 싫다 한다,"처갓집에 장이 떨어져서 국을 끓일 수 없게 되었는데 마침 사위가 국은 싫어서 먹지 않겠다고 한다는 뜻으로, 어떤 일이 서로 공교롭게도 때맞추어 일어남을 비유적으로 이르는 말. "
가시어미 눈멀 사위,"사위가 왔을 때에 국을 끓여 주느라 생기는 연기와 김으로 장모의 눈을 멀게 할 사위라는 뜻으로, 국을 매우 좋아하는 사람을 비유적으로 이르는 말. "
가시어미 장 떨어지자 사위가 국 싫다 한다,"처갓집에 장이 떨어져서 국을 끓일 수 없게 되었는데 마침 사위가 국은 싫어서 먹지 않겠다고 한다는 뜻으로, 어떤 일이 서로 공교롭게도 때맞추어 일어남을 비유적으로 이르는 말. "
가위다리치다,길이가 있는 물건을 ‘×’ 모양으로 서로 어긋매껴 놓다. 
가을 더위와 노인의 건강,"가을의 더위와 노인의 건강은 오래갈 수 없다는 뜻으로, 끝장이 가까워 그 기운이 쇠하고 오래가지 못함을 비유적으로 이르는 말. "
가을마당에 빗자루 몽당이를 들고 춤을 추어도 농사 밑이 어둑하다,"가을에 타작을 하여 줄 것은 주고 갚을 것은 갚고 빈손에 빗자루만 남게 되더라도 그래도 남은 것이 있다는 뜻으로, 농사일은 든든한 것임을 이르는 말. "
가을 메는 부지깽이도 덤벙인다,"「1」가을에 메는 용도가 많아 부지깽이도 메로 쓰인다는 뜻으로, 어떤 물건이 자주 쓰이어 그와 비슷한 것까지 마구 대용됨을 이르는 말. 「2」가을걷이 때에는 일이 많아서 누구나 바삐 나서서 거들게 됨을 비유적으로 이르는 말. "
가을 물은 소 발자국에 고인 물도 먹는다,가을 물이 매우 맑고 깨끗함을 비유적으로 이르는 말. 
