Idiom,Meaning
대들보 썩는 줄 모르고 기왓장 아끼는 격,장차 크게 손해 볼 것은 모르고 당장 돈이 조금 든다고 사소한 것을 아끼는 어리석은 행동을 비유적으로 이르는 말. 
대로 한길 노래로 열라,"큰길을 노래를 부르며 가라는 뜻으로, 낙관적인 마음으로 앞길을 개척해 나가라는 말. "
대매에 때려 죽일 놈,크게 잘못한 사람을 욕하는 말. 
대명전 대들보의 명매기 걸음,맵시를 내고 아양을 부리며 아장아장 걷는 여자의 걸음을 비유적으로 이르는 말. 
대모관자 같으면 되겠다,쓸모가 많아서 여러 방면에서 자주 찾아 주는 사람이 많았으면 좋겠다는 말. 
대모관자 같으면 뛰겠다,"대모관자라도 너무 자주 매었다 풀었다 하면 끊어지겠다는 뜻으로, 사람을 너무 자주 부르는 경우를 비유적으로 이르는 말. "
대못을 박다,‘못(을) 박다’를 강조하여 이르는 말. 
대문 밖이 저승이라,"「1」사람은 언제 죽을지 모른다는 뜻으로, 사람의 목숨이 덧없음을 비유적으로 이르는 말. 「2」머지않아 곧 죽게 될 것임을 비유적으로 이르는 말. "
대문을 열다,"「1」정치, 경제, 문화 따위의 여러 분야에서 외부와의 관계를 가지다. 「2」일정한 조직에 새로 성원을 받아들이다. "
대문이 가문,「1」아무리 가문이 높아도 가난하여 집채나 대문이 작으면 위엄이 없어 보인다는 말. 「2」겉보기가 훌륭하여야 남에게 위압을 준다는 말. 
대문턱 높은 집에 정강이 높은 며느리 들어온다,일이 마침 알맞게 잘되어 감을 비유적으로 이르는 말. 
대반 앉다,대반의 역할을 하다. 
대봉치다,다른 것으로 대신 채우다. 
대부등에 곁낫질이라[낫걸이라],"큰 아름드리 나무를 조그만 낫으로 베려는 것과 같다는 뜻으로, 세력이 아주 큰 것에 몹시 작은 것으로 덤비려 함을 비유적으로 이르는 말. "
대 뿌리에서 대가 난다,모든 일은 근본에 따라 거기에 걸맞은 결과가 나타나는 것임을 비유적으로 이르는 말. 
대사 뒤에 병풍 지고 나간다,"남의 집 잔치에 왔다가 병풍을 지고 간다는 뜻으로, 너무도 염치없는 짓을 함을 이르는 말. "
대사에 낭패 없다,관혼상제와 같은 큰일은 시작만 해 놓으면 어떻게든 치러 내게 된다는 말. 
대신 댁 송아지 백정 무서운 줄 모른다,남의 권력만 믿고 거만을 부림을 비유적으로 이르는 말. 
대신 집 강아지 범 무서운 줄 모른다,남의 권력만 믿고 거만을 부림을 비유적으로 이르는 말. 
대우파다[내다/치다],다른 작물을 심은 밭이랑에 콩이나 팥 따위를 심다. 
대장의 집에 식칼이 논다,"칼을 만드는 대장장이의 집에 오히려 식칼이 없다는 뜻으로, 어떠한 물건이 흔하게 있을 듯한 곳에 의외로 많지 않거나 없음을 비유적으로 이르는 말. "
대장장이 집에 식칼이 놀고 미장이 집에 구들장 빠진 게 삼 년 간다,"칼을 만드는 대장장이의 집에 오히려 식칼이 없다는 뜻으로, 어떠한 물건이 흔하게 있을 듯한 곳에 의외로 많지 않거나 없음을 비유적으로 이르는 말. "
대중삼다,어림짐작의 표준으로 삼다. 
대중잡다,어림짐작으로 헤아려 짐작하다. 
대중치다,어림짐작으로 셈 치다. 
대천가의 논은 살 것이 아니다,큰 강가의 논은 수해를 입기가 쉬움을 비유적으로 이르는 말. 
대천 바다도 건너 봐야 안다,"사람은 겉만 보고는 알 수 없으며, 서로 오래 겪어 보아야 알 수 있음을 이르는 말. "
대추나무에 연 걸리듯,여기저기에 빚을 많이 진 것을 비유적으로 이르는 말. 
대통 맞은 병아리 같다,남에게 얻어맞거나 의외의 일을 당하여 정신이 멍한 것을 비유적으로 이르는 말. 
대포놓다,허풍을 치거나 터무니없는 거짓말을 하다. 
대학을 가르칠라,미련한 자가 어리석은 말을 함을 비유적으로 이르는 말. 옛날에 한 농부가 촌 선생에게서 ≪대학≫을 배우다가 답답하여 공부를 단념하고 돌아가서 밭을 갈다가 소가 말을 듣지 않자 소에게 “≪대학≫을 가르칠까 보다.”라고 하였다는 말에서 유래한다. 
대한 끝에 양춘이 있다,「1」어렵고 괴로운 일을 겪고 나면 즐겁고 좋은 일도 있음을 비유적으로 이르는 말. 「2」세상의 일은 돌고 도는 것임을 비유적으로 이르는 말. 
대한의 운예,"대한에 비가 올 징조를 기대한다는 뜻으로, 어떤 일이 일어나기를 갈망함을 이르는 말. "
대한이 소한의 집에 가서 얼어 죽는다,글자 뜻으로만 보면 대한이 소한보다 추워야 할 것이나 사실은 소한 무렵이 더 추운 것을 비유적으로 이르는 말. 
대한 칠 년 비 바라듯,"칠 년이나 계속되는 큰 가뭄에 비 오기를 바란다는 뜻으로, 몹시 간절히 바람을 비유적으로 이르는 말. "
댑싸리 밑의 개 팔자,하는 일 없이 놀고먹는 편한 팔자를 비유적으로 이르는 말. 
댓구멍으로 하늘을 본다,"조그만 바늘구멍으로 넓디넓은 하늘을 본다는 뜻으로, 전체를 포괄적으로 보지 못하는 매우 좁은 소견이나 관찰을 비꼬는 말. "
댓진 먹은 뱀 ,"뱀이 담뱃대에 엉긴 진을 먹으면 즉사한다는 데서, 이미 운명이 결정된 사람을 비유적으로 이르는 말. "
더도 말고 덜도 말고 늘 가윗날만 같아라,"가윗날은 백곡이 익는 계절인 만큼 모든 것이 풍성하고 즐거운 놀이를 하며 지낸 데서, 잘 먹고 잘 입고 편히 살기를 바라는 말. "
더러운 처와 악한 첩이 빈방보다 낫다,아무리 못된 아내라도 없는 것보다 있는 것이 좋음을 비유적으로 이르는 말. 
더벅머리 댕기 치레하듯,바탕이 좋지 않은 것에 어울리지 않게 지나친 겉치레를 하여 오히려 더 흉하게 된 것을 비유적으로 이르는 말. 
더부살이가 주인마누라 속곳 베 걱정한다,"남의 집에 더부살이하면서 제 옷도 변변히 못 입는 형편에 주인집 마누라의 속곳 마련할 걱정을 한다는 뜻으로, 주제넘게 남의 일에 대하여 걱정함을 비유적으로 이르는 말. "
더부살이 환자 걱정,"남의 집에 더부살이하면서 제 옷도 변변히 못 입는 형편에 주인집 마누라의 속곳 마련할 걱정을 한다는 뜻으로, 주제넘게 남의 일에 대하여 걱정함을 비유적으로 이르는 말. "
더운죽에 파리 날아들듯,무턱대고 덤벙이다가 곤경에 빠짐을 비유적으로 이르는 말. 
더운죽에 혀 데기,"「1」더운죽에 혀를 대면 덴다는 것을 뻔히 알면서도 어리석게 혀를 댄다는 뜻으로, 그르칠 것이 뻔한 일을 하는 것을 비유적으로 이르는 말. 「2」대단치 않은 일에 낭패를 보아 비록 짧은 동안이나마 어찌할 바를 모르는 것을 비유적으로 이르는 말. "
더운 피,의로운 일을 위하여 바치는 피. 
더워서 못 먹고 식어서 못 먹고,이런저런 구실과 조건을 대면서 이러쿵저러쿵 불만이 많음을 비유적으로 이르는 말. 
더위들다,여름철에 더위 때문에 몸에 이상 증세가 생기다. 
더위먹다,여름철에 더위 때문에 몸에 이상 증세가 생기다. 
더위사다,"정월 보름날에 행해지는 더위팔기 풍습에서 나온 말로, 남이 자기의 이름을 불렀을 때 대답을 하면 그 사람의 더위까지 가지게 되어 한여름에 더위를 먹게 됨을 이르는 말. "
더위팔다,"정월 보름날에 행해지는 더위팔기 풍습에서 나온 말로, 남의 이름을 불러 상대방이 대답을 하면 자신의 더위를 남에게 주어 한여름에 더위를 먹지 않게 됨을 이르는 말. "
더위 먹은 소 달만 보아도 헐떡인다,어떤 사물에 몹시 놀란 사람은 비슷한 사물만 보아도 겁을 냄을 이르는 말. 
덕보다,남에게 이익이나 도움을 입다. 
덕되다,이익이나 도움이 되다. 
덕석이 멍석이라고 우긴다,약간 비슷함을 빙자하여 그 실물인 것처럼 자처함을 비유적으로 이르는 말. 
덕석이 멍석인 듯,약간 비슷함을 빙자하여 그 실물인 것처럼 자처함을 비유적으로 이르는 말. 
던져 마름쇠,"「1」마름쇠는 누구나 던지면 틀림없이 꽂히고 한쪽은 위로 솟는 데서, 어떤 일에 별로 숙달되지 않은 사람도 실수 없이 능히 할 수 있는 일인 경우를 비유적으로 이르는 말. 「2」어떻게 하든 한 가지 정해진 경우밖에 달리는 되지 않는 것을 비유적으로 이르는 말. "
덜 곪은 부스럼에 아니 나는 고름 짜듯,상을 몹시 찌푸리는 모양을 비유적으로 이르는 말. 
덜미잡히다,못된 일 따위를 꾸미다가 발각되다. 
덜미짚다,「1」덜미잡이를 하다. 「2」덜미를 잡아 누르듯이 몹시 재촉하다. 
덜미치다,약점이나 제일 중요한 곳에 공격을 하거나 타격을 가하다. 
덜미가 잡히다,죄가 드러나다. 
덜미를 넘겨짚다,남의 속을 떠보다. 
덜미를 누르다,몹시 재촉하거나 몰아세우다. 
덜미를 눌러놓다,상대편의 약점을 잡아서 꼼짝 못 하게 하다. 
덜미를 잡다[쥐다],꼼짝 못 하게 하다. 
덜미에 사잣밥을 짊어졌다,언제 어디서 죽을지 모를 위험한 처지에 놓여 있음을 비유적으로 이르는 말. 
덤불이 커야 도깨비가 난다,「1」자기에게 덕망이 있어야 사람들이 따르게 됨을 비유적으로 이르는 말. 「2」일정한 바탕이나 조건이 갖추어져야 그것에 합당한 내용이 따르게 됨을 비유적으로 이르는 말. 
덧두리치다,덧두리를 가로채다. 
덩더꿍이 소출,"먹고 살아갈 일정한 재산이 없는 사람이 돈이 생기면 생긴 대로 흥청망청 쓰고, 없으면 어렵게 지냄을 비유적으로 이르는 말. "
덩덩하니 굿만 여겨,무엇이 얼씬만 하여도 좋은 일이나 구경거리가 있는 줄 알고 속단함을 비유적으로 이르는 말. 
덩덩하니 문 너머 굿인 줄 아느냐,무엇이 얼씬만 하여도 좋은 일이나 구경거리가 있는 줄 알고 속단함을 비유적으로 이르는 말. 
덫 안에 든 쥐,궁지에서 벗어날 수 없는 처지를 비유적으로 이르는 말. 
"덫에 치인 범이요, 그물에 걸린 고기라",꼼짝없이 막다른 처지에 몰린 형세가 됨을 비유적으로 이르는 말. 
덮어놓고 열넉 냥[열닷 냥] 금,내용을 살피지 않고 함부로 판단함을 비유적으로 이르는 말. 
덴 가슴,어떤 일에 한번 몹시 혼난 일이 있는 사람이 걸핏하면 병적으로 가슴을 두근거리며 겁냄을 비유적으로 이르는 말. 
덴 데 털 안 난다,"크게 덴 상처에는 털이 안 난다는 뜻으로, 한 번 크게 실패를 하면 다시 일어나기 어려움을 비유적으로 이르는 말. "
덴 소 날치듯,"불에 덴 소가 이리 뛰고 저리 뛰며 날치듯 한다는 뜻으로, 물불을 가리지 못하고 함부로 날뜀을 비유적으로 이르는 말. "
도닦다,깨달음의 경지를 얻기 위하여 수양에 힘쓰다. 
도가뜨다,도가를 하려고 관원이 나오다. 
도감 포수 마누라 오줌 짐작하듯,"도감 포수가 새벽에 영내(營內)에 들어갈 때 그 시각을 마누라가 오줌 누는 시간으로 짐작한다는 뜻으로, 분명하지 않은 일을 짐작으로 판단하고 믿으면 낭패하기 쉽다는 말. "
도갓집 강아지 같다,사람들이 많이 모여들어 나드는 도갓집 강아지처럼 사람의 동정을 잘 살피며 눈치가 빠른 사람을 비유적으로 이르는 말. 
도깨비 기왓장 뒤듯,"「1」집안이 망하려면 도깨비가 기왓장을 뒤져 흐트러뜨린다는 이야기에서 나온 것으로, 쓸데없이 이것저것 분주하게 뒤지기만 하는 모양을 비유적으로 이르는 말. 「2」남 보기에 분주하게 일을 엄벙덤벙하는 모양을 비유적으로 이르는 말. "
도깨비는 방망이로 떼고 귀신은 경으로 뗀다,귀찮은 존재를 떼는 데는 특수한 방법이 있다는 말. 
도깨비 달밤에 춤추듯,멋없이 거드럭거리는 모양을 비유적으로 이르는 말. 
도깨비 대동강 건너듯,일의 진행이 눈에 띄지는 않으나 그 결과가 빨리 나타나는 모양을 비유적으로 이르는 말. 
도깨비도 수풀이 있어야 모인다,"언덕이 있어야 소도 가려운 곳을 비비거나 언덕을 디뎌 볼 수 있다는 뜻으로, 누구나 의지할 곳이 있어야 무슨 일이든 시작하거나 이룰 수가 있음을 비유적으로 이르는 말. "
도깨비도 수풀이 있어야 재주를 피운다,아무리 재능이 있는 사람일지라도 일정한 조건이 마련되어야 그 재능을 나타낼 수 있음을 비유적으로 이르는 말. 
도깨비 땅 마련하듯,무엇을 하기는 하나 결국 아무 실속 없이 헛된 일만 하는 모양을 비유적으로 이르는 말. 
도깨비를 사귀었나,까닭도 모르게 재산이 부쩍부쩍 늘어 가는 경우를 비유적으로 이르는 말. 
도깨비 사귄 셈이라,귀찮은 자가 조금도 곁을 떠나지 않고 늘 따라다니는 경우를 비유적으로 이르는 말. 
도깨비 살림,있다가도 별안간 없어지는 불안정한 살림살이. 
도깨비 수키왓장 뒤듯,"「1」집안이 망하려면 도깨비가 기왓장을 뒤져 흐트러뜨린다는 이야기에서 나온 것으로, 쓸데없이 이것저것 분주하게 뒤지기만 하는 모양을 비유적으로 이르는 말. 「2」남 보기에 분주하게 일을 엄벙덤벙하는 모양을 비유적으로 이르는 말. "
도깨비 쓸개라,무엇이나 보잘것없이 작고 추잡한 것임을 비유적으로 이르는 말. 
도깨비에 홀린 것 같다,일의 내막을 알 수 없어 무슨 영문인지 정신을 차리지 못하다. 
도깨비 음모같다,사물이 서로 비슷하다. 
도깨비 장난 같다,하는 짓이 분명하지 않아서 갈피를 잡을 수 없다. 
도끼가 제 자루 깎지 못한다,자기의 허물을 자기가 알아서 고치기 어려움을 비유적으로 이르는 말. 
도끼가 제 자루 못 찍는다,자기의 허물을 자기가 알아서 고치기 어려움을 비유적으로 이르는 말. 
도끼 가진 놈이 바늘 가진 놈을 못 당한다,도끼같이 큰 무기를 가지고 있다고 하여 상대편의 사정을 봐주다가는 도리어 바늘을 가지고 있는 사람에게 진다는 말. 
도끼는 날을 달아 써도 사람은 죽으면 그만,물건은 다시 고쳐 쓸 수 있어도 사람은 생명을 다시 이어 살 수 없다는 말. 
도끼는 무디면 갈기나 하지 사람은 죽으면 다시 오지 못한다,물건은 다시 고쳐 쓸 수 있어도 사람은 생명을 다시 이어 살 수 없다는 말. 
도끼 등에 칼날을 붙인다,서로 맞지 않는 것을 가져다 대고 붙이려고 하는 헛된 짓을 비유적으로 이르는 말. 
도끼라 날 달아 쓸까,「1」물건은 다시 고쳐 쓸 수 있어도 사람은 생명을 다시 이어 살 수 없다는 말. 「2」어떤 물건이 다시 쓸 수 없게 된 경우를 비유적으로 이르는 말. 
도끼로 제 발등 찍는다,남을 해칠 요량으로 한 것이 결국은 자기에게 해롭게 된 경우를 비유적으로 이르는 말. 
도끼를 베고 잤나,밤잠을 편히 못 자고 너무 이른 아침에 일어난 경우를 비유적으로 이르는 말. 
도끼 삶은 물,「1」아무 맛도 없는 것을 비유적으로 이르는 말. 「2」아무런 내용도 없는 것을 비유적으로 이르는 말. 
도낏자루를 쥐다,어떤 일에 실제적인 권한을 가지다. 
도낏자루 썩는 줄 모른다,"어떤 나무꾼이 신선들이 바둑 두는 것을 정신없이 보다가 제정신이 들어보니 세월이 흘러 도낏자루가 다 썩었다는 데서, 아주 재미있는 일에 정신이 팔려서 시간 가는 줄 모르는 경우를 비유적으로 이르는 말. "
도남의 날개,"남쪽을 향하여 벌리려는 대붕의 날개라는 뜻으로, 어느 곳에 가서 큰 사업을 하여 보겠다는 계획을 비유적으로 이르는 말. "
도는 개는 배 채우고 누운 개는 옆 챈다,활동하면 얻는 바가 있지만 누워서 게으름이나 피우면 옆구리나 차이기 마련임을 비유적으로 이르는 말. 
도둑개가 겻섬에 오른다,자기가 하고 싶은 것을 할 때에는 그 동작이 매우 재빠름을 비유적으로 이르는 말. 
도둑개 살 안 찐다,늘 남의 것을 탐하는 자는 재물을 모으지 못함을 비유적으로 이르는 말. 
도둑고양이가 살찌랴,늘 남의 것을 탐하는 자는 재물을 모으지 못함을 비유적으로 이르는 말. 
도둑고양이가 제상에 오른다,못된 사람이 무엄한 짓을 한다는 말. 
도둑고양이더러 제물 지켜 달라 한다,"고양이한테 생선을 맡기면 고양이가 생선을 먹을 것이 뻔한 일이란 뜻으로, 어떤 일이나 사물을 믿지 못할 사람에게 맡겨 놓고 마음이 놓이지 않아 걱정함을 비유적으로 이르는 말. "
도둑놈 개 꾸짖듯,남이 알까 두려워서 입속으로 중얼거림을 비유적으로 이르는 말. 
도둑놈 개에게 물린 셈,자신의 잘못 때문에 봉변을 당하여도 아무 말 못 하는 경우를 비유적으로 이르는 말. 
도둑놈더러 인사불성이라 한다,크게 잘못한 사람에게 조그만 허물만 탓함을 비유적으로 이르는 말. 
도둑놈도 인정이 있다,아무리 나쁜 사람일지라도 인정은 있음을 비유적으로 이르는 말. 
도둑놈 딱장 받듯,남을 너무 욱대김을 비유적으로 이르는 말. 
도둑놈 문 열어 준 셈,믿지 못할 사람을 신용하여 일을 맡기는 어리석음을 비유적으로 이르는 말. 
도둑놈 볼기짝 같다,"도둑이 관가에 잡혀가 볼기를 맞아서 멍이 든 것과 같다는 뜻으로, 얼굴 빛깔이 시푸르죽죽함을 비유적으로 이르는 말. "
도둑놈 부싯돌만 한 놈,하잘것없는 사람을 낮잡아 이르는 말. 
도둑놈 소 몰듯,당황하여 황급히 서두르는 모양을 비유적으로 이르는 말. 
도둑놈 열쇠 맡긴 셈,믿지 못할 사람을 신용하여 일을 맡기는 어리석음을 비유적으로 이르는 말. 
"도둑놈은 한 죄, 잃은 놈은 열 죄","도둑은 물건을 훔친 죄 하나밖에 없으나 잃은 사람은 간수를 잘못한 일, 공연히 남을 의심한 일 따위의 여러 가지 죄를 짓게 됨을 비유적으로 이르는 말. "
도둑놈의 뒤턱을 친다,"도둑을 등쳐 재물 따위를 빼앗는다는 뜻으로, 아주 못된 짓을 함을 비유적으로 이르는 말. "
도둑놈이 몽둥이 들고 길 위에 오른다,잘못한 놈이 도리어 기세를 올리고 나무람을 비유적으로 이르는 말. 
도둑놈이 씻나락을 헤아리랴,뒷날은 생각지 않고 당장의 이익만 보고 해 먹는 자를 비유적으로 이르는 말. 
도둑놈이 제 말에 잡힌다,나쁜 짓을 하고 그것을 숨기려고 하나 저도 모르는 사이에 죄를 드러내고 맒을 비유적으로 이르는 말. 
도둑놈이 제 발자국에 놀란다,나쁜 짓을 하고 그것을 숨기려고 하나 저도 모르는 사이에 죄를 드러내고 맒을 비유적으로 이르는 말. 
도둑놈 허접 대듯,무슨 잘못을 저질러 놓고 그것을 감추려고 정신없이 애씀을 비유적으로 이르는 말. 
도둑맞고 사립[빈지] 고친다,"소를 도둑맞은 다음에서야 빈 외양간의 허물어진 데를 고치느라 수선을 떤다는 뜻으로, 일이 이미 잘못된 뒤에는 손을 써도 소용이 없음을 비꼬는 말. "
도둑맞고 죄 된다,도둑을 맞고는 공연히 무고한 사람까지 의심하게 됨을 비유적으로 이르는 말. 
도둑맞으면 어미 품도 들춰 본다,물건을 잃게 되면 누구나 다 의심스럽게 여겨짐을 비유적으로 이르는 말. 
도둑에게 열쇠 준다,믿지 못할 사람을 신용하여 일을 맡기는 어리석음을 비유적으로 이르는 말. 
도둑에도 의리가 있고 딴꾼에도 꼭지가 있다,못된 짓을 하는 자들에게도 저희끼리 지켜야 하는 의리나 질서가 있음을 비유적으로 이르는 말. 
도둑을 뒤로 잡지 앞으로 잡나,"도둑은 분명한 증거를 가지고 잡아야지 의심만으로는 잡을 수 없다는 뜻으로, 확실한 증거가 없이 추측만으로는 남을 의심하거나 이렇다 저렇다 말할 수 없음을 비유적으로 이르는 말. "
도둑을 맞으려면 개도 안 짖는다,운수가 나쁘면 모든 것이 제대로 되지 않음을 비유적으로 이르는 말. 
도둑의 두목도 도둑이요 그 졸개도 또한 도둑이라,윗자리에 앉아 시키는 놈이나 그대로 따라 하는 놈이나 다 마찬가지로 나쁜 놈임을 비유적으로 이르는 말. 
도둑의 때는 벗어도 자식의 때는 못 벗는다,자식의 잘못은 어쩔 수 없이 부모가 책임져야 함을 비유적으로 이르는 말. 
도둑의 때는 벗어도 화냥의 때는 못 벗는다,부정한 품행을 삼가야 함을 비유적으로 이르는 말. 
도둑의 묘에 잔 부어 놓기,대접받을 가치가 없는 사람에게 과분한 대접을 함과 같이 일을 잘못 처리함을 비유적으로 이르는 말. 
도둑의 씨가 따로 없다,"특별히 타고난 도둑은 없다는 뜻으로, 사람이란 주위의 환경과 조건에 따라 누구나 도둑이 될 수 있음을 비유적으로 이르는 말. "
도둑의 집에도 되는 있다,못된 짓을 하는 사람에게도 경위와 종작이 있음을 비유적으로 이르는 말. 
도둑의 집에 한당이 들었다,몹쓸 놈이 그보다 더 몹쓸 놈에게 변을 당함을 비유적으로 이르는 말. 
도둑의 찌끼는 있어도 불의 찌끼는 없다,도둑이 지나간 자리는 남는 것이 있어도 화재가 났던 자리는 아무것도 남는 것이 없다는 말. 
도둑이 달릴까 했더니 우뚝 선다,잘못한 놈이 도리어 기세를 올리고 나무람을 비유적으로 이르는 말. 
도둑이 도둑이야 한다,지은 죄를 숨기려고 한 짓이 도리어 죄를 드러내고 맒을 비유적으로 이르는 말. 
도둑이 들려면 개도 안 짖는다,운수가 나쁘면 모든 것이 제대로 되지 않음을 비유적으로 이르는 말. 
도둑이 매를 든다,잘못한 놈이 도리어 기세를 올리고 나무람을 비유적으로 이르는 말. 
도둑이 없으면 법도 쓸데없다,도둑질이 가장 나쁨을 비유적으로 이르는 말. 
도둑이 제 발 저리다,지은 죄가 있으면 자연히 마음이 조마조마하여짐을 비유적으로 이르는 말. 
도둑이 포도청 간다,지은 죄를 숨기려고 한 짓이 도리어 죄를 드러내고 맒을 비유적으로 이르는 말. 
도둑질도 혼자 해 먹어라,"무슨 일이나 여럿이 하면 말이 많아지고 손이 맞지 않아 실수하기 쉬우니, 혼자 하는 것이 가장 좋음을 비유적으로 이르는 말. "
도둑질은 내가 하고 오라는 네가 져라,나쁜 짓을 해서 이익은 자기가 차지하고 그것에 대한 벌은 남보고 받으라는 경우를 비유적으로 이르는 말. 
도둑질을 하다 들켜도 변명을 한다,아무리 큰 잘못을 저지른 사람도 그것을 변명하고 이유를 붙일 수 있다는 말. 
도둑질을 하더라도 사모 바람에 거드럭거린다,나쁜 짓을 하고도 벼슬아치라는 배짱으로 도리어 남을 야단치고 뽐내며 횡포를 부린다는 말. 
도둑질을 해도 손발[눈]이 맞아야 한다,무슨 일이든지 두 편에서 서로 뜻이 맞아야 이루어질 수 있다는 말. 
도둑질한 사람은 오그리고 자고 도둑맞은 사람은 펴고 잔다,남에게 해를 입힌 사람은 마음이 불안하나 해를 입은 사람은 오히려 마음이 편하다는 말. 
도둑 한 놈에 지키는 사람 열이 못 당한다,도난을 방지하기가 어려움을 비유적으로 이르는 말. 
도랑에 든 소,"도랑 양편에 우거진 풀을 다 먹을 수 있는 소라는 뜻으로, 이리하거나 저리하거나 풍족한 형편에 놓인 사람 또는 그런 형편을 비유적으로 이르는 말. "
도랑 치고 가재 잡는다,「1」일의 순서가 바뀌었기 때문에 애쓴 보람이 나타나지 않음을 비유적으로 이르는 말. 「2」한 가지 일로 두 가지 이익을 봄을 비유적으로 이르는 말. 
도래떡이 안팎이 없다,"둥글넓적한 도래떡은 안과 밖의 구별이 없다는 뜻으로, 두루뭉술하여 어떻다고 판단을 내리기가 어려움을 비유적으로 이르는 말. "
도련님은 당나귀가 제격이라,제격에 맞게 물건을 쓰거나 행동해야 어울림을 비유적으로 이르는 말. 
도련님 천량,"아직 돈을 쓸 줄 모르는 도련님의 돈이라는 뜻으로, 쓰지 않고 오붓하게 모은 돈을 비유적으로 이르는 말. "
도련님 풍월에 염이 있으랴,어리고 서투른 사람이 하는 일이 신통할 리가 없으니 심하게 나무랄 것이 못 됨을 비유적으로 이르는 말. 
