Idiom,Meaning
오초의 흥망이 내 알 바 아니다,「1」주변에서 무슨 일이 일어나도 자기는 상관하지 않겠다는 말. 「2」세상에 무슨 일이 있더라도 자기는 자기가 맡은 일이나 충실히 하겠다는 말. 
옥도 갈아야 빛이 난다,「1」아무리 소질이 좋아도 이것을 잘 닦고 기르지 아니하면 훌륭한 것이 되지 못한다는 말. 「2」고생을 겪으며 노력을 기울여야 뜻한 바를 이룰 수 있다는 말. 
옥반에 진주 굴듯[구르듯],목소리가 매우 청아하고 아름다움을 비유적으로 이르는 말. 
옥밥먹다,(속되게) 감옥에 갇혀 지내는 생활을 하다. 
옥석도 닦아야 빛이 난다,「1」아무리 소질이 좋아도 이것을 잘 닦고 기르지 아니하면 훌륭한 것이 되지 못한다는 말. 「2」고생을 겪으며 노력을 기울여야 뜻한 바를 이룰 수 있다는 말. 
옥에는 티나 있지,"옥에는 티가 있으나 그런 티조차 없다는 뜻으로, 행실이 결백하여 흠이 없거나 완전무결함을 비유적으로 이르는 말. "
옥에도 티가 있다,아무리 훌륭한 사람 또는 좋은 물건이라 하여도 자세히 따지고 보면 사소한 흠은 있다는 말. 
옥에 티,나무랄 데 없이 훌륭하거나 좋은 것에 있는 사소한 흠을 이르는 말. 
온다 간다 말 없이,자기 거취에 대하여서 아무에게도 말하지 아니하고 슬그머니. 
온면 먹을 제부터 그르다,"국수를 먹는 혼인날부터 벌써 글렀다는 뜻으로, 일이 시작될 때부터 잘못됨을 이르는 말. "
온몸의 힘줄이 용대기 뒤 줄이 되었다,"온몸의 힘줄이 임금이 거둥할 때 들고 나가는 용대기의 뒤 벌이줄처럼 팽팽하다는 뜻으로, 사람이 극도로 흥분한 경우를 비유적으로 이르는 말. "
온몸이 입이라도 말 못 하겠다,잘못이 명백히 드러나 변명의 여지가 없음을 비유적으로 이르는 말. 
온 바닷물을 다 먹어야 짜냐,"무슨 일이나 끝장을 보지 아니하면 손을 놓지 아니하는, 욕심이 많은 사람에게 하는 말. "
온 바닷물을 다 켜야 맛이냐,"무슨 일이나 끝장을 보지 아니하면 손을 놓지 아니하는, 욕심이 많은 사람에게 하는 말. "
온 세상을 얻은 듯,세상에 부러울 것 하나 없이 매우 만족해하는 경우를 비유적으로 이르는 말. 
온실 속에서 자란 화초,어려움이나 고난을 겪지 아니하고 그저 곱게만 자란 사람을 비유적으로 이르는 말. 
온실 속의 화초,어려움이나 고난을 겪지 아니하고 그저 곱게만 자란 사람을 비유적으로 이르는 말. 
온양 온천에 헌[전] 다리 모이듯,"온양이 유명한 온천지라 다리가 헌 병자들이 많이 모인다는 뜻으로, 많은 사람이 어지러이 모이는 모양을 이르는 말. "
온전한 기와가 부서진 옥보다 낫다,아무리 귀한 물건이라도 깨어지면 제구실을 하지 못하므로 하찮고 온전한 것보다 못하다는 말. 
온통으로 생긴 놈 계집 자랑 반편으로 생긴 놈 자식 자랑,"「1」큰 천치는 아내 자랑하는 사람이고 반 천치는 자식 자랑하는 사람이라는 뜻으로, 지나치게 사랑하여 눈이 어두워지는 경우를 경계하는 말. 「2」아내 자랑, 자식 자랑하는 사람을 조롱하는 말. "
올되다,(비유적으로) 거만하고 고집이 세다. 
올가미쓰다,남의 꾀에 걸려들다. 
올가미씌우다,계략을 써서 남을 걸려들게 하다. 
올가미 없는 개장사,밑천 없이 하는 장사를 낮잡아 이르는 말. 
올 것이 오다,좋지 않은 일이 예상대로 당연하게 일어나다. 
올빼미 눈 같다,(비유적으로) 낮에 잘 보지 못하다. 또는 낮보다 밤에 더 잘 보다. 
올챙이 개구리 된 지 몇 해나 되나,"어떤 일에 좀 익숙하여진 사람이나, 가난하다가 형편이 좀 나아진 사람이 지나치게 젠체함을 비꼬는 말. "
올챙이 적 생각은 못 하고 개구리 된 생각만 한다,형편이나 사정이 전에 비하여 나아진 사람이 지난날의 미천하거나 어렵던 때의 일을 생각지 아니하고 처음부터 잘난 듯이 뽐냄을 비유적으로 이르는 말. 
옳은 일을 하면 죽어도 옳은 귀신이 된다,착한 마음씨를 지니고 살면 죽어도 유감됨이 없음을 이르는 말. 
옴 덕에 보지 긁는다,남이 꺼리는 일을 할 핑계가 생김을 비유적으로 이르는 말. 
옴딱지 떼고 비상 칠한다,"앓는 옴을 빨리 고치겠다는 욕심에 옴딱지를 떼고 비상을 칠하여 더욱 악화시킨다는 뜻으로, 일을 빨리 처리하려고 무리한 방법을 써서 일을 더욱 어렵게 만듦을 비유적으로 이르는 말. "
옴딱지 떼듯,무엇이나 인정사정없이 내버리는 모양을 비유적으로 이르는 말. 
옴치고 뛸 수 없다,「1」어쩔 도리가 없게 되다. 「2」꼼짝할 수 없다. 
옷깃을 여미다,경건한 마음으로 옷을 가지런하게 하여 자세를 바로잡다. 
옷은 나이로 입는다,「1」옷차림 따위의 모든 일을 나이나 경우에 어울리게 하여야 한다는 말. 「2」몸집은 좀 작더라도 나이 든 사람은 옷을 더 크게 입는다는 말. 
옷은 새 옷이 좋고 사람은 옛 사람이 좋다,물건은 새것이 좋고 사람은 오래 사귀어 서로를 잘 알고 정분이 두터워진 사람이 좋다는 말. 
옷은 새 옷이 좋고 임은 옛 임이 좋다,물건은 새것이 좋고 사람은 오래 사귀어 서로를 잘 알고 정분이 두터워진 사람이 좋다는 말. 
옷은 시집올 때처럼 음식은 한가위처럼,"옷은 시집올 때 가장 잘 입을 수 있고 음식은 한가위에 가장 잘 먹을 수 있다는 뜻으로, 언제나 잘 입고 잘 먹고 싶다는 말. "
옷을 격해 가려운 데를 긁는다,"신을 신고 발바닥을 긁으면 긁으나 마나라는 뜻으로, 요긴한 곳에 직접 미치지 못하여 안타까운 경우를 비유적으로 이르는 말. "
옷이 날개고 밥이 분이다,옷을 잘 입어야 풍채가 좋아지고 밥을 잘 먹어야 신수가 좋아진다는 말. 
옷이 날개라,옷이 좋으면 사람이 돋보인다는 말. 
옷 입고 가려운 데 긁기,"신을 신고 발바닥을 긁으면 긁으나 마나라는 뜻으로, 요긴한 곳에 직접 미치지 못하여 안타까운 경우를 비유적으로 이르는 말. "
옹이지다,마음에 언짢은 감정이 있다. 
옹이에 마디,「1」어려운 일이 공교롭게 계속됨을 비유적으로 이르는 말. 「2」일마다 공교롭게도 방해가 끼어 낭패를 보게 됨을 비유적으로 이르는 말. 
옻올리다,옻이 올라 살갗이 헐어 부스럼이 돋다. 
와우각상의 싸움,「1」좁은 곳에서 싸우거나 하찮은 일을 가지고 아옹다옹 다툼을 비유적으로 이르는 말. 「2」작은 나라끼리의 싸움을 비유적으로 이르는 말. 
왔다 갔다 하다,정신이 맑았다 흐렸다 하다. 
왕개미 정자나무 흔드는 격,아무리 건드려도 까딱도 하지 않음을 비유적으로 이르는 말. 
왕공도 망국하고 학사도 망신한다,"사람은 아무리 귀하게 잘 살다가도 천해질 수 있으며, 아무리 훌륭한 사람도 큰 실수를 하여 낭패를 보는 수가 있음을 비유적으로 이르는 말. "
왕기뜨이다(01),행복스럽게 될 조짐이 보이다. 
왕기뜨이다(02),임금이 날 조짐이나 임금이 될 조짐이 보이다. 
왕대밭에 왕대 난다,「1」모든 일은 근본에 따라 거기에 걸맞은 결과가 나타나는 것임을 비유적으로 이르는 말. 「2」어버이와 아주 딴판인 자식은 있을 수 없음을 이르는 말. 
왕방울로 솥[가마] 가시듯,쇠로 만든 솥을 왕방울로 가실 때처럼 왁자지껄하게 떠드는 소리를 비유적으로 이르는 말. 
왕방울로 퉁노구 가시는 소리,쇠로 만든 솥을 왕방울로 가실 때처럼 왁자지껄하게 떠드는 소리를 비유적으로 이르는 말. 
왕지네 마당에 씨암탉 걸음,"왕지네가 가득한 마당에 씨암탉이 걷는 걸음걸이라는 뜻으로, 살이 쪄서 어기적어기적 걷는 모양을 비유적으로 이르는 말. "
왕후장상이 씨가 있나,높은 자리에 오르는 것은 가문이나 혈통 따위에 따른 것이 아니라 자신의 능력에 따른 것임을 이르는 말. 
왜가리 새 여울목 넘어다보듯,「1」무엇을 얻을 것이 없나 하여 엿보거나 넘겨다보는 모양을 비유적으로 이르는 말. 「2」남의 눈을 피하여 가며 제 이익만을 취함을 비유적으로 이르는 말. 
왜 감중련을 하였나,서로 어울려 다정히 지내지 아니하고 저만 따로 위엄만 차리는 경우를 비유적으로 이르는 말. 
왜 알 적에 안 곯았나,"태어나기 전에 죽었더라면 좋았을 것이라는 뜻으로, 사람의 용모가 추잡하고 하는 짓이 못됐을 때 비꼬는 말. "
왜장녀냐 제명월냐 똥 덮개냐,매무시가 흐트러져 어지럽고 더러움을 이르는 말. 
외갓집 들어가듯,예의도 차릴 필요 없이 자기 집에 들어가는 것처럼 남의 집에 거리낌 없이 쉽게 들어감을 비유적으로 이르는 말. 
외갓집 콩죽에 잔뼈가 굵었겠나,"남에게 신세를 지고 남의 호의로 살아온 것이 아니라는 뜻으로, 새삼스레 남의 도움을 받기 싫어 거절할 때 이르는 말. "
외 거꾸로 먹어도 제 재미다,자기만 좋으면 어떻게 하든지 상관없음을 이르는 말. 
외곽을 때리다,우회적으로 상대방에게 해를 끼치다. 
외국 물을 먹다,외국에서 생활을 하다. 
외나무다리에서 만날 날이 있다,꺼리고 싫어하는 대상을 피할 수 없는 곳에서 공교롭게 만나게 됨을 비유적으로 이르는 말. 
외 덩굴에 가지 열릴까,「1」모든 일은 원인이 있으면 반드시 그에 따른 결과가 있음을 이르는 말. 「2」어버이와 아주 딴판인 자식은 있을 수 없음을 이르는 말. 
외로 지나 바로 지나,"짐을 왼쪽으로 지나 오른쪽으로 지나 등에 지기는 마찬가지라는 뜻으로, 이렇게 하나 저렇게 하나 마찬가지인 경우를 비유적으로 이르는 말. "
외로 틀다,일이나 의견 따위에 동의하지 아니하고 어긋나가다. 
외며느리 고운 데 없다,며느리가 여럿이면 비교하여서 좋은 점도 찾을 수 있겠으나 외며느리라 그럴 수 없고 또 본디 며느리란 밉게 보이기 마련이라는 말. 
외모는 거울로 보고 마음은 술로 본다,술이 들어가면 본심을 털어놓고 이야기함을 이르는 말. 
외밭 원수는 고슴도치고 너하고 나하고의 원수는 중매쟁이라,중매결혼을 하고 사이가 나빠진 부부가 중매쟁이를 원망하는 말. 
외삼촌 물에 빠졌는가 ,「1」남이 크게 웃을 때 이르는 말. 「2」남의 작은 실수를 보고도 잘 웃는 사람을 보고 하는 말. 
외삼촌 사는 골에 가지도 말랬다,외삼촌과 조카 사이란 매우 소원한 관계임을 비유적으로 이르는 말. 
외삼촌 산소에 벌초하듯,일에 정성을 들이지 아니하고 마지못하여 건성으로 함을 비유적으로 이르는 말. 
외상이면 사돈집 소도 잡아먹는다,뒷일은 어떻게 되든지 생각하지 아니하고 우선 당장 좋으면 그만인 것처럼 무턱대고 행동함을 비유적으로 이르는 말. 
외상이면 소[당나귀]도 잡아먹는다,뒷일은 어떻게 되든지 생각하지 아니하고 우선 당장 좋으면 그만인 것처럼 무턱대고 행동함을 비유적으로 이르는 말. 
외손뼉이 못 울고 한 다리로 가지 못한다,"「1」두 손뼉이 마주쳐야 소리가 나지 외손뼉만으로는 소리가 나지 아니한다는 뜻으로, 일은 상대가 같이 응하여야지 혼자서만 해서는 잘되는 것이 아님을 비유적으로 이르는 말. 「2」상대 없는 분쟁이 없음을 비유적으로 이르는 말. "
외손뼉이 소리 날까,"「1」두 손뼉이 마주쳐야 소리가 나지 외손뼉만으로는 소리가 나지 아니한다는 뜻으로, 일은 상대가 같이 응하여야지 혼자서만 해서는 잘되는 것이 아님을 비유적으로 이르는 말. 「2」상대 없는 분쟁이 없음을 비유적으로 이르는 말. "
외손뼉이 울랴,"「1」두 손뼉이 마주쳐야 소리가 나지 외손뼉만으로는 소리가 나지 아니한다는 뜻으로, 일은 상대가 같이 응하여야지 혼자서만 해서는 잘되는 것이 아님을 비유적으로 이르는 말. 「2」상대 없는 분쟁이 없음을 비유적으로 이르는 말. "
외손뼉이 울지 못한다,"「1」두 손뼉이 마주쳐야 소리가 나지 외손뼉만으로는 소리가 나지 아니한다는 뜻으로, 일은 상대가 같이 응하여야지 혼자서만 해서는 잘되는 것이 아님을 비유적으로 이르는 말. 「2」상대 없는 분쟁이 없음을 비유적으로 이르는 말. "
외손의 방축이라,"외손자네 둑이라는 뜻으로, 무슨 일이든지 대수롭지 아니하게 여기고 그냥 지나쳐 버림을 이르는 말. "
외손자는 업고 친손자는 걸리면서 업은 아이 발 시리다 빨리 가자 한다,"「1」딸에 대한 극진한 사랑으로, 친손자가 더 소중하면서도 외손자를 더 귀여워함을 이르는 말. 「2」사랑에 있어 경중이 바뀌었다는 뜻으로, 행동에서 주객이 뒤바뀌었음을 이르는 말. "
외손자를 귀애하느니 방앗공이[절굿공이]를 귀애하지,외손자는 아무리 귀여워하고 공을 들여도 귀여워한 보람이 없다는 말. 
외손자를 보아 주느니 파밭을 매지,외손자는 아무리 귀여워하고 공을 들여도 귀여워한 보람이 없다는 말. 
외 심은 데 콩 나랴,「1」모든 일은 원인이 있으면 반드시 그에 따른 결과가 있음을 이르는 말. 「2」어버이와 아주 딴판인 자식은 있을 수 없음을 이르는 말. 
외아들 잡아먹은 할미 상,더없이 궁상맞고 처참한 표정을 비유적으로 이르는 말. 
외 얽고 벽 친다,"담벼락을 쌓은 것 같다는 뜻으로, 사물을 이해하지 못함을 이르는 말. "
외주둥이 굶는다,혼자 살면 끼니를 굶는 일이 많다는 말. 
외톨밤이 벌레가 먹었다,「1」단 하나뿐인 소중한 물건에 흠집이 생김을 비유적으로 이르는 말. 「2」똑똑하고 분명하여야 할 것이 그렇지 못하고 부실함을 비유적으로 이르는 말. 특히 외아들이 쓸데없이 되어 버린 경우를 이른다. 
왼고개를 치다,부정이나 반대의 뜻을 나타내다. 
왼고개를 틀다,무엇이 못마땅하여 바로 보지 아니하고 외면하다. 
왼발 구르고 침 뱉는다,무슨 일에나 처음에는 앞장서서 나서지만 곧 꽁무니를 뺌을 비유적으로 이르는 말. 
왼새끼꼬다,「1」일이 꼬여 어떻게 될지 몰라 애를 태우다. 「2」심히 우려하거나 조심하여 말하고 행동하다. 「3」비비 꼬아서 말하거나 비아냥거리다. 「4」속으로 딴마음을 먹거나 은근히 딴 꾀를 꾸미다. 
왼새끼 내던졌다,두 번 다시 돌아볼 생각 없이 아주 내버림을 비유적으로 이르는 말. 
왼팔도 쓸 데가 있다,평상시에 잘 쓰지 아니하는 것도 쓸모 있을 때가 있음을 비유적으로 이르는 말. 
요강 뚜껑으로 물 떠먹은 셈,별 일은 없으리라고 생각하면서도 꺼림칙함을 비유적으로 이르는 말. 
요령 도둑놈,생김새가 흉악스럽고 눈알이 커서 늘 눈을 부라리고 있는 사람을 비유적으로 이르는 말. 
요 모양 요 꼴,좋지 않은 처지나 형편. 
요원의 불길,"매우 빠르게 번지는 벌판의 불길이라는 뜻으로, 무서운 기세로 퍼져 가는 세력 따위를 비유적으로 이르는 말. "
욕심사납다,몹시 욕심이 많다. 
욕심은 부엉이 같다,욕심이 매우 많음을 비유적으로 이르는 말. 
욕심이 눈을[앞을] 가리다,욕심 때문에 사리 판단이나 분별을 제대로 못 하다. 
욕심이 사람 죽인다,욕심이 너무 지나치면 사리를 분별하지 못하고 위태로운 일까지 거리낌 없이 하게 됨을 비유적으로 이르는 말. 
욕은 욕으로 갚고 은혜는 은혜로 갚는다,남이 나를 대하는 것만큼 나도 남을 그만큼밖에는 대접하지 아니한다는 것을 비유적으로 이르는 말. 
욕이 금인 줄 알아라,자기의 잘못에 대한 꾸지람을 고깝게만 생각하지 말고 자기의 발전과 수양을 위해서 소중히 받아들이라는 말. 
용되다,변변하지 못하던 것이 크게 좋아지다. 
용 가는 데 구름 가고 범 가는 데 바람 간다,반드시 같이 다녀서 둘이 서로 떠나지 아니할 경우를 비유적으로 이르는 말. 
용 가는 데 구름 간다,반드시 같이 다녀서 둘이 서로 떠나지 아니할 경우를 비유적으로 이르는 말. 
용검도 써야 칼이지,아무리 훌륭한 물건이라도 실제로 쓰지 아니한다면 쓸모없음을 비유적으로 이르는 말. 
용대기 내세우듯,사소한 재주가 있다 하여 툭하면 그것을 내세우며 자랑하는 경우를 비유적으로 이르는 말. 
용대기에 비 맞다,낙심해서 활기나 기세가 약해지다. 
용 될 고기는 모이 철부터 안다,잘될 사람은 어려서부터 남달리 장래성이 엿보인다는 말. 
용마 갈기 사이에 뿔 나거든,아무리 바라도 소용이 없다는 말. 
용 못 된 이무기,의리나 인정은 찾아볼 수 없고 심술만 남아 있어 남에게 손해만 입히는 사람을 비유적으로 이르는 말. 
용 못 된 이무기 방천 낸다,못된 사람은 못된 짓만 한다는 말. 
용문산 안개 두르듯,남루한 옷을 지저분하게 치렁치렁 걸친 모양을 비유적으로 이르는 말. 
용문산에 안개 모이듯,푸른 하늘에 구름이 모여들 듯이 여기저기서 한곳으로 많이 모여드는 모양을 비유적으로 이르는 말. 
용미에 범 앉은[맞은] 것 같다,위엄이 있어 남을 억압하는 듯한 인상을 지닌 사람을 비유적으로 이르는 말. 
용수지르다,술이나 간장을 뜨기 위하여 용수를 박다. 
용수가 채반이 되도록 우긴다,사리에 맞지 아니하는 의견을 끝까지 주장하는 경우를 비꼬아 이르는 말. 
용수에 담은 찰밥도 엎지르겠네,복이 없는 자는 좋은 운수를 만나도 그것을 능히 오래 보전하지 못하거나 놓친다는 것을 비유적으로 이르는 말. 
용용 죽겠지,"몹시 약이 올라 죽겠지라는 뜻으로, 남을 약 올리면서 하는 말. "
용을 낳다,훌륭한 인물을 낳다. 
용의 알을 얻은 것 같다,아주 귀중한 보배를 얻은 것처럼 좋아서 아끼는 경우를 비유적으로 이르는 말. 
용의 초리,"「1」폭포에서 내리 쏟아지는 물줄기를 비유적으로 이르는 말. 「2」예전에, 처녀나 총각이 길게 땋아서 늘어뜨린 머리를 비유적으로 이르던 말. "
용이 개천에 빠지면 모기붙이 새끼가 엉겨 붙는다,아무리 좋은 처지에 있던 사람이라도 불행한 경우나 환경에 빠지게 되면 하찮은 사람에게서까지 모욕을 당하고 괄시를 받게 된다는 말. 
용이 물 밖에 나면 개미가 침노를 한다,아무리 좋은 처지에 있던 사람이라도 불행한 경우나 환경에 빠지게 되면 하찮은 사람에게서까지 모욕을 당하고 괄시를 받게 된다는 말. 
용이 물을 잃은 듯,"용이 물을 잃고는 살 수 없는 것처럼, 처지가 매우 궁박하여 살길이 끊어진 상황을 비유적으로 이르는 말. "
용이 여의주를 얻고 범이 바람을 탐과 같다,"무슨 일이나 뜻한 바를 다 이루어, 두려운 것이 없는 경우를 비유적으로 이르는 말. "
용이 여의주를 얻으면 하늘로 올라가고야 만다,무엇이나 어떤 단계에 이르면 최종적인 결과가 나타나게 됨을 비유적으로 이르는 말. 
용춤추다,남이 추어올리는 바람에 신이 나서 하라는 대로 하다. 
우는 가슴에 말뚝 박듯,그렇지 않아도 가슴이 아픈데 더욱 큰 상처를 줌을 비유적으로 이르는 말. 
우는 아이 똥 먹이기,"빚을 물지 못하는 값으로 빚진 사람의 아내를 빼앗아 간다는 뜻으로, 인정 없고 심술궂으며 무도한 짓을 비유적으로 이르는 말. "
우는 아이 젖 준다,무슨 일에 있어서나 자기가 요구하여야 쉽게 구할 수 있음을 이르는 말. 
우는 애도 속이 있어 운다,"아무런 이유 없이 우는 아이가 없다는 뜻으로, 겉으로 나타난 행동은 속에 품은 뜻을 표현하는 것임을 이르는 말. "
우둔한 것이 범 잡는다,앞뒤를 살피지 아니하고 덥석 대드는 사람이 뜻밖에 큰일을 하는 수가 있다는 말. 
우러러 하늘에도 부끄럽지 않고 굽어 땅에도 부끄럽지 않다,양심에 거리끼는 것이 조금도 없고 아주 떳떳함을 비유적으로 이르는 말. 
우렁이도 두렁 넘을 꾀가 있다,미련하고 못난 사람도 제 요량은 있어 한 가지 재주는 있다는 말. 
우렁이도 집이 있다,"하찮은 우렁이도 다 제집이 있는 법이라는 뜻으로, 집 없는 사람의 서러운 처지를 한탄하여 이르는 말. "
우렁이 속에도 생각이 들었다,아무리 어리석고 못난 사람이라도 다 그 나름대로의 생각을 갖고 있음을 이르는 말. 
우레같은 박수,많은 사람이 치는 매우 큰 소리의 박수를 비유적으로 이르는 말. 
우립 만드는 동안에 날이 갠다,"비가 와서 우립을 만들면 이미 늦다는 뜻으로, 미리미리 준비를 하여야 한다는 말. "
우마가 기린 되랴,"소나 말 같은 흔하고 천한 동물이 귀하고 상서로운 기린이 될 리가 없다는 뜻으로, 본시 제가 타고난 대로밖에는 아무리 하여도 안 됨을 비유적으로 이르는 말. "
우물가 공론,"여자들이 우물가에서 물을 긷거나 빨래 따위를 하며 주고받는, 세상 이야기나 소문을 이르는 말. "
우물가에 애 보낸 것 같다,"어린아이를 우물가에 내놓으면 언제 우물에 빠질지 몰라 마음이 불안하다는 뜻으로, 몹시 걱정이 되어 마음이 놓이지 아니하는 상태를 비유적으로 이르는 말. "
우물고누 첫수,「1」상대편을 꼼짝 못 하게 할 수 있을 정도의 가장 좋은 대책을 비유적으로 이르는 말. 「2」다른 변통은 할 재주가 없는 사람이 쓰는 유일한 수단을 비유적으로 이르는 말. 
우물 공사,공동 우물 같은 곳에서 물을 긷거나 빨래 따위를 하면서 잡담을 즐기는 일을 비유적으로 이르는 말. 
우물귀신 잡아넣듯 하다,"우물귀신은 다른 사람을 끌어넣어 대신 귀신을 만든 다음에야 비로소 탈출할 수 있다는 미신에서 생긴 말로, 어떤 어려움이나 걱정 속에서 자기가 벗어나기 위하여 남을 대신 밀어 넣어 곤란한 지경에 빠뜨리는 것을 비유적으로 이르는 말. "
우물둔덕에 애 내놓은 것 같다,"어린아이를 우물가에 내놓으면 언제 우물에 빠질지 몰라 마음이 불안하다는 뜻으로, 몹시 걱정이 되어 마음이 놓이지 아니하는 상태를 비유적으로 이르는 말. "
우물 들고 마시겠다,성미가 몹시 급함을 비꼬는 말. 
우물물은 퍼내야 고인다,무엇이나 자꾸 써야 새것이 생긴다는 말. 
우물 밑에 똥 누기,심술 사납고 고약한 짓을 비유적으로 이르는 말. 
우물 안 개구리[고기],「1」넓은 세상의 형편을 알지 못하는 사람을 비유적으로 이르는 말. 「2」견식이 좁아 저만 잘난 줄로 아는 사람을 비꼬는 말. 
우물에 가 숭늉 찾는다,모든 일에는 질서와 차례가 있는 법인데 일의 순서도 모르고 성급하게 덤빔을 비유적으로 이르는 말. 
우물에 든 고기,빠져나올 수 없는 곤경에 처하여서 마지막 운명만을 기다리고 있는 처지를 비유적으로 이르는 말. 
우물 옆에서 목말라[말라] 죽는다,사람이 무슨 일에나 도무지 융통성이 없고 처신할 줄 모름을 비유적으로 이르는 말. 
우물을 파도 한 우물을 파라,일을 너무 벌여 놓거나 하던 일을 자주 바꾸어 하면 아무런 성과가 없으니 어떠한 일이든 한 가지 일을 끝까지 하여야 성공할 수 있다는 말. 
우박치다,「1」우박이 마구 쏟아지다. 「2」탄알이나 포탄 따위가 몹시 심하게 떨어지다. 
우박 맞은 잿더미[소똥] 같다,"숭숭 구멍이 뚫렸다는 뜻으로, 얼굴이 심하게 얽은 사람을 놀림조로 이르는 말. "
우박 맞은 잿더미 같고 활량의 사포 같다,"숭숭 구멍이 뚫렸다는 뜻으로, 얼굴이 심하게 얽은 사람을 놀림조로 이르는 말. "
우선 먹기는 곶감이 달다,앞일은 생각해 보지도 아니하고 당장 좋은 것만 취하는 경우를 비유적으로 이르는 말. 
우수 경칩에 대동강 물이 풀린다,우수와 경칩을 지나면 아무리 춥던 날씨도 누그러짐을 이르는 말. 
우숫물지다,우숫물로 큰물이 지다. 
