Idiom,Meaning
빌려 온 말이 삼경이 되었다,"말을 잠깐 타고 돌려주겠다고 했는데, 시간이 흘러 밤늦은 삼경(三更)이 되었다는 뜻으로, 잠깐 빌려 온 물건이 그럭저럭 오래되었음을 비유적으로 이르는 말. "
빌어는 먹어도 다리아랫소리 하기는 싫다,아무리 궁핍하여도 비굴하게 남에게 아첨하거나 빌붙기는 싫음을 비유적으로 이르는 말. 
빌어먹는 놈이 이밥 조밥 가리랴,"한창 궁하여 빌어먹는 판에 이밥 조밥 가릴 수 없다는 뜻으로, 자기가 아쉽거나 급히 필요한 일에는 좋고 나쁨을 가릴 겨를이 없음을 비유적으로 이르는 말. "
빌어먹는 놈이 콩밥을 마다할까,"한창 궁하여 빌어먹는 판에 콩밥이라고 마다할 수 없다는 뜻으로, 자기가 아쉽거나 급히 필요한 일에는 좋고 나쁨을 가릴 겨를이 없음을 비유적으로 이르는 말. "
빌어먹던 놈이 천지개벽을 해도 남의 집 울타리 밑을 엿본다,오래된 버릇은 갑자기 벗어나지 못함을 비유적으로 이르는 말. 
빌어먹어도 절하고 싶지 않다,아무리 궁핍하여도 비굴하게 남에게 아첨하거나 빌붙기는 싫음을 비유적으로 이르는 말. 
빗자루론 개도 안 때린다,빗자루로 사람을 때릴 때 말리면서 하는 말. 
빗장을 지르다,마음속의 생각을 남에게 드러내지 아니하고 굳게 감추다. 
빙산의 일각,대부분이 숨겨져 있고 외부로 나타나 있는 것은 극히 일부분에 지나지 아니함을 비유적으로 이르는 말. 
빚놓다,여러 사람에게 빚을 주다. 
빚주다,이자를 받기로 하고 돈을 꾸어 주다. 
빚값에 계집 뺏기,"빚을 물지 못하는 값으로 빚진 사람의 아내를 빼앗아 간다는 뜻으로, 인정 없고 심술궂으며 무도한 짓을 비유적으로 이르는 말. "
빚 물어 달라는 자식은 낳지도 말랬다,자식을 낳아서 기르는 것만 하여도 큰일인데 그 위에 빚까지 물어 달라는 것은 큰 불효일 뿐 아니라 사람 노릇도 제대로 하지 못한 자라는 말을 비유적으로 이르는 말. 
빚 보인하는[보증하는] 자식은 낳지도 말라,빚보증 서는 것은 지극히 위험한 일임을 비유적으로 이르는 말. 
빚 얻어 굿하니 맏며느리 춤춘다,"없는 형편에 빚까지 내서 굿을 하니 맏며느리가 분수 없이 굿판에 뛰어들어 춤을 춘다는 뜻으로, 어렵게 된 일을 잘하려고 노력하여야 할 사람이 도리어 엉뚱한 행동을 한다는 말. "
빚은 값으로나 떡이라지,"떡이 도무지 떡답지가 않고 빚어서 만들었다는 점만 떡 같다는 뜻으로, 제 기능을 잘 못하는 물건을 아쉬운 대로 써야 하는 경우를 이르는 말. "
빚쟁이 발을 뻗고 잠을 못 잔다,"남에게 빚을 진 사람은 발을 뻗고 편안하게 잠자지 못한다는 뜻으로, 남에게 빚을 진 사람은 늘 빚 갚을 일이 걱정되어 마음 편한 날이 없음을 비유적으로 이르는 말. "
빚 주고 뺨 맞기,"남을 위하여 빚을 주고는 도리어 인사는 고사하고 뺨을 얻어맞게 되었다는 뜻으로, 남을 위하여 노력하거나 후하게 대접하고는 오히려 봉변을 당하게 되는 경우를 비유적으로 이르는 말. "
빚 준 상전이요 빚 쓴 종이라,빚진 사람은 빚 준 사람의 종이나 다름이 없다는 말. 
빚진 죄인[종],빚진 사람은 빚 준 사람에게 죄인이나 종처럼 기를 펴지 못하고 구속받게 됨을 비유적으로 이르는 말. 
빛은 검어도 속은 희다,겉은 어지러워도 속은 깨끗함을 이르는 말. 
빛을 발하다,제 능력이나 값어치를 드러내다. 
빛을 보다,업적이나 보람 따위가 드러나다. 
빛 좋은 개살구,"겉보기에는 먹음직스러운 빛깔을 띠고 있지만 맛은 없는 개살구라는 뜻으로, 겉만 그럴듯하고 실속이 없는 경우를 비유적으로 이르는 말. "
빠른 바람에 굳센 풀을 안다,"드센 바람 속에 꿋꿋이 서 있는 굳센 풀을 알아낼 수 있다는 뜻으로, 마음의 굳은 의지와 절개는 시련을 겪고 나서 더 뚜렷하게 나타난다는 말. "
빠진 괴머리,아무짝에도 쓸모없는 사람을 비유적으로 이르는 말. 
빠진 도낏자루,언행이 횡포하고 무도하여 껄렁껄렁한 사람을 비유적으로 이르는 말. 
빨간 거짓말,뻔히 드러날 만큼 터무니없는 거짓말. 
빨간 상놈,더 말할 나위 없는 상놈. 
빨간 상놈 푸른 양반,모든 것을 드러내 놓고 마구 사는 상놈과 서슬이 푸르게 점잔을 빼고 있는 양반을 대조하여 이르는 말. 
빨다린 체 말고 진솔로 있거라,"옷을 빨아 다렸더라도 마구 드러내지 말고 진솔로 그대로 가지고 있으라는 뜻으로, 언제나 본래 모습을 잃지 말고 순수함을 지키라는 것을 비유적으로 이르는 말. "
빨래 이웃은 안 한다,빨래할 때 가까이 있으면 구정물이나 튀지 좋은 일은 없다는 말. 
빨리 먹은 콩밥 똥 눌 때 보자 한다,"꼭꼭 씹지 아니하고 급하게 삼켜 버린 콩은 삭지 아니한 채 그대로 나온다는 뜻으로, 무슨 일이든 급히 서두르면 탈이 생김을 비유적으로 이르는 말. "
빨리 알기는 칠월 귀뚜라미라,음력 칠월만 되면 울기 시작하는 가을 귀뚜라미처럼 영리하고 눈치 빠름을 비유적으로 이르는 말. 
빳빳이 굶다,먹을 것이 없거나 먹고 싶지 않아 아주 굶다. 
빵따냄은 삼십 집,빵따냄의 위력이 삼십 집의 위력에 상당하다는 말. 
빼다박다,모양이나 상황 따위가 비슷하다. 
빼도 박도 못하다,일이 몹시 난처하게 되어 그대로 할 수도 그만둘 수도 없다. 
뺑대쑥 밭이 되었다,집터 따위가 폐허로 되어 빈터만 남았다. 
뺑덕어멈 외상 빚 걸머지듯,빚을 잔뜩 걸머지고 헤어나지 못하는 모양을 비유적으로 이르는 말. 
뺑줄치다,「1」뺑줄을 던져서 남의 연을 낚아채다. 「2」남의 물건을 중간에서 가로채다. 
뺨맞을 놈이 여기 때려라 저기 때려라 한다,죄를 지어 마땅히 벌을 받아야 할 사람이 처분을 기다리지 아니하고 도리어 제 좋을 대로 요구함을 비웃는 말. 
뺨 맞는 데 구레나룻이 한 부조,"쓸모없어 보이던 구레나룻도 뺨을 맞을 경우에는 아픔을 덜어 준다는 뜻으로, 아무 소용 없는 듯한 물건이 뜻밖에 도움을 주게 됨을 비유적으로 이르는 말. "
뺨을 맞아도 은가락지 낀 손에 맞는 것이 좋다,이왕 꾸지람을 듣거나 벌을 받을 바에는 권위 있고 덕망 있는 사람에게 당하는 것이 나음을 비유적으로 이르는 말. 
뺨 잘 때리기는 나막신 신은 깍정이라,"뺨 잘 때리기로는 나막신 신은 깍정이를 따라잡을 사람이 없다는 뜻으로, 되지 못하고 비열한 자가 도리어 잘난 체하며 남을 몹시 학대한다는 말. "
뻐꾸기도 유월이 한철이라,"뻐꾸기도 음력 유월이 한창 활동할 시기라는 뜻으로, 누구나 한창 활동할 수 있는 시기는 얼마 되지 아니하니 그때를 놓치지 말라는 말. "
뻔뻔하기가 양푼 밑구멍 같다,"양푼의 밑이 편편하다는 데서, 뻔뻔스럽기 짝이 없고 아주 철면피함을 비유적으로 이르는 말. "
뻗어 가는 칡도 한[끝]이 있다,무슨 일이든지 일정한 한도가 있음을 비유적으로 이르는 말. 
뻗정다리 서나 마나,일을 하나 하지 않으나 별로 차이가 없다는 말. 
뻗친 쇠발,이미 착수하여 버린 일임을 이르는 말. 
뻘건 거짓말,뻔히 드러날 만큼 터무니없는 거짓말. 
뻘건 상놈,더 말할 나위 없는 상놈. 
뼈빠지게,오랫동안 육체적 고통을 견디어 내면서 힘겨운 일을 치러 나가는 것을 비유적으로 이르는 말. 
뼈가 녹다[녹아나다],어렵거나 고된 일로 고생하다. 
뼈가 휘도록,오랫동안 육체적 고통을 견디어 내면서 힘겨운 일을 치러 나가는 것을 비유적으로 이르는 말. 
뼈다귀녹이다,「1」마음을 황홀하게 만들다. 「2」뼈 없는 사람처럼 몸이나 마음을 가눌 수 없게 만들다. 
뼈대있다,「1」문벌이 좋다. 「2」심지가 굳고 줏대가 있다. 
뼈대가 굵어지다,자라서 성년이 되다. 
뼈도 못 추리다,죽은 뒤에 추릴 뼈조차 없을 만큼 상대와 싸움의 적수가 안 되어 손실만 보고 전혀 남는 것이 없다. 
뼈를 긁어내다,마음속의 고통 따위가 몹시 심하다. 
뼈를 깎다[갈다],몹시 견디기 어려울 정도로 고통스럽다. 
뼈를 묻다,단체나 조직에 평생토록 헌신하다. 
뼈만 남다,못 먹거나 심하게 앓거나 하여 지나치게 여위다. 
뼈만 앙상하다,못 먹거나 심하게 앓거나 하여 지나치게 여위다. 
뼈에 사무치다,원한이나 고통 따위가 뼛속에 파고들 정도로 깊고 강하다. 
뼈에 새기다,‘가슴에 새기다’를 강조하여 이르는 말. 
뼈와 살로 만들다,"경험, 사상, 이론 따위를 자기의 확고한 신념으로 만들다. "
뼈와 살이 되다,정신적으로 도움이 되다. 
뼛골빼다,원기가 탈진하여 힘이 모두 없어지게 하다. 
뼛골빠지다,육체적으로 매우 힘든 일을 하여 나가다. 
뼛골아프다,너무나 고통스러워 뼛속까지 아프다. 
뼛골에 사무치다,‘뼈에 사무치다’를 강조하여 이르는 말. 
뽕 내 맡은 누에 같다,뽕 내 맡은 누에가 정신없이 달려들 듯이 마음에 흡족하여 어쩔 줄 몰라 하는 모양을 비유적으로 이르는 말. 
뽕도 따고 임도 보고[본다],"뽕 따러 나가니 누에 먹이를 장만할 뿐만 아니라 사랑하는 애인도 만나 정을 나눈다는 뜻으로, 두 가지 일을 동시에 이룸을 비유적으로 이르는 말. "
뿌리깊다,어떤 일이나 사물의 연유하는 바가 오래다. 
뿌리빠지다,근원까지 없어져 아무것도 남는 것이 없게 되다. 
뿌리뽑다,어떤 것이 생겨나고 자랄 수 있는 근원을 없애 버리다. 
뿌리 깊은 나무 가뭄 안 탄다,"땅속 깊이 뿌리 내린 나무는 가뭄에 타지 않아 말라 죽는 일이 없다는 뜻으로, 무엇이나 근원이 깊고 튼튼하면 어떤 시련도 견뎌 냄을 비유적으로 이르는 말. "
뿌리 뽑히다,어떤 것이 생겨나고 자랄 수 있는 근원이 없어지다. 
뿌리 없는 나무가 없다,「1」모든 나무가 다 뿌리가 있듯이 무엇이나 그 근본이 있음을 비유적으로 이르는 말. 「2」원인이 없이 결과만 있을 수 없음을 이르는 말. 
뿌리 없는 나무에 잎이 필까,원인이 없으면 결과가 있을 수 없음을 비유적으로 이르는 말. 
뿔 떨어지면 구워 먹지,"든든히 붙어 있는 뿔이 떨어지면 구워 먹겠다고 기다린다는 뜻으로, 도저히 불가능한 일을 바라고 기다림을 비웃는 말. "
뿔 뺀 쇠 상이라,"뿔을 빼 버린 소의 모양이라는 뜻으로, 지위는 있어도 세력을 잃은 처지를 이르는 말. "
사개맞다,말이나 사리의 앞뒤 관계가 빈틈없이 딱 들어맞다. 
사공이 많으면 배가 산으로 간다[올라간다],"여러 사람이 저마다 제 주장대로 배를 몰려고 하면 결국에는 배가 물로 못 가고 산으로 올라간다는 뜻으로, 주관하는 사람 없이 여러 사람이 자기주장만 내세우면 일이 제대로 되기 어려움을 비유적으로 이르는 말. "
사관트다,사관에 침을 놓다. 
사귀어야 절교하지,"서로 관계가 있어야 끊을 일도 있다는 뜻으로, 어떤 원인이 있어야 결과가 있음을 이르는 말. "
사기전에 종짓굽 맞추듯,틀림없고 영락없는 모양을 비유적으로 이르는 말. 
사기 접시를 죽으로 엎칠 것 같다,"한 죽이나 되는 많은 사기 접시를 단번에 엎어서 깰 것같이 야단이라는 뜻으로, 당장 어떤 큰일을 치를 듯이 들볶음을 비유적으로 이르는 말. "
사나운 개도 먹여 주는 사람은 안다,"아무리 사나운 개라도 저를 먹여 주는 사람만은 알아서 꼬리 치며 반갑게 대한다는 뜻으로, 자기에게 은혜를 베풀어 주는 고마운 사람을 알아보지 못하는 것은 짐승만도 못함을 이르는 말. "
사나운 개 입[콧등] 성할 날 없다,성질이 사나운 사람은 늘 싸움만 하여 상처가 미처 나을 사이가 없음을 비유적으로 이르는 말. 
사나운 개 콧등 아물 틈[날]이 없다,성질이 사나운 사람은 늘 싸움만 하여 상처가 미처 나을 사이가 없음을 비유적으로 이르는 말. 
사나운 말에는 특별한 길마 지운다,"사나운 말은 여느 말과 다른 길마를 지워서 단단히 다룬다는 뜻으로, 사람도 성격이 거칠고 행실이 사나우면 그에 맞는 특별한 제재를 받게 됨을 이르는 말. "
사나운 암캐같이 앙앙하지 마라,부녀자가 떠들썩하게 지껄이고 다투는 것을 욕하는 말. 
사나운 암캐같이 앙앙한다,(속되게) 부녀자들이 듣기 싫게 앙앙거리다. 
사나운 팔자는 불에도 타지 않는다,타고난 운명이 좋지 않은 것은 피하려야 피할 길이 없음을 비유적으로 이르는 말. 
사내가 바가지로 물을 마시면 수염이 안 난다,남자들이 부엌에 자주 드나들면 남자답게 되지 못한다는 말. 
사내가 어디 가나 옹솥하고 계집은 있다,"어떤 남자라도 밥할 만한 작은 밥솥과 같이 살 여자는 다 가지고 있다는 뜻으로, 못난 남자라도 밥벌이와 아내는 얻게 됨을 이르는 말. "
사내가 우비하고 거짓말은 가지고 다녀야 한다,"남자가 비 올 때 쓸 우비와 급할 때 둘러댈 거짓말을 갖추고 다녀야 한다는 뜻으로, 남자가 처세하려면 거짓말도 필요함을 이르는 말. "
사내는 도둑질 빼고 다 배워라,남자는 넓은 경험과 기술을 가져야 함을 이르는 말. 
사내는 죽을 때 계집과 돈을 머리맡에 놓고 죽어라,남자가 늙어서는 아내와 돈이 있어야 된다는 말. 
사내 등골빼먹는다,화류계 여성이 외도하는 남자의 재물을 훑어 먹음을 이르는 말. 
"사내 못난 것은 대가리만 크고, 계집 못난 것은 젖통만 크다","머리통이 큰 남자, 가슴이 큰 여자를 비꼬는 말. "
사내 못난 것은 북문에 가 호강받는다,"조선 후기에, 아무리 못난 사내라도 서울의 북쪽에 있는 숙정문(肅靖門)에만 가면 많은 부녀자로부터 추파를 받고 환대를 받았음을 이르는 말. "
사내 못난 것은 사랑에 가서 먹이나 갈아 주고 계집 못난 것은 젖통만 크다,"사내 못난 것은 남의 집 사랑방에 가서 선비들 글 쓰는 곁에 앉아 벼루에 먹 갈아 주는 시중이나 하고 계집 못난 것은 일할 줄은 모르면서 젖가슴만 크다는 뜻으로, 남자나 여자나 똑똑지 못할 때는 몸차림도 단정하지 못하고 하는 짓도 못난 짓만 골라 함을 비웃는 말. "
사내 상처 세 번 하면 대감 한 것만 하다,세 번이나 장가를 들게 되는 것은 대감 한 것만큼이나 대단한 호강임을 이르는 말. 
사내아이가 열다섯이면 호패를 찬다,"남자의 나이 열다섯이 되면 어른으로 취급하는데, 이미 열다섯이니 제 한몫을 할 때가 되었음을 강조하여 이르는 말. "
사내자식 길 나설 때 갈모 하나 거짓말 하나는 가지고 나서야 한다,"남자가 비 올 때 쓸 우비와 급할 때 둘러댈 거짓말을 갖추고 다녀야 한다는 뜻으로, 남자가 처세하려면 거짓말도 필요함을 이르는 말. "
사냥 가는 데 총 놓고 간다,무슨 일을 하러 가면서 거기에 가장 긴요한 물건을 빠뜨리고 감을 비유적으로 이르는 말. 
사냥 가는 데 총을 안 가지고 가는 것 같다,무슨 일을 하러 가면서 거기에 가장 긴요한 물건을 빠뜨리고 감을 비유적으로 이르는 말. 
사냥개 언 똥 들어먹듯[삼키듯],음식을 매우 빨리 먹어 버리는 모습을 비유적으로 이르는 말. 
사당 당직은 타도 빈대 당직 타서 시원하다,"사당의 당직은 불타 버렸지만 그와 함께 빈대까지 탔으니 시원하다는 뜻으로, 제게 손해가 되더라도 시끄럽고 귀찮던 것이 없어져 시원함을 이르는 말. "
사당치레하다가 신주 개 물려 보낸다,"사당 겉치레만 하며 돌아다니다가 사당에 두는 신주를 개한테 물려 보냈다는 뜻으로, 겉치레만 지나치게 하다가 그만 중요한 것을 잃어버림을 이르는 말. "
사돈잔치에 중이 참여한다,"신랑집에서 신붓집에 구혼하는 경사스러운 일에 포도군사가 나타남은 당치 아니하다는 뜻으로, 연회나 기타의 장소에 전연 관계없는 사람이 끼어드는 경우를 비유적으로 이르는 말. "
사돈 남 나무란다,자기도 같은 잘못을 했으면서 제 잘못은 제쳐 두고 남의 잘못만 나무란다는 말. 
사돈네 논 산대,"사돈네가 논을 사거나 말거나 신경 쓰며 관계할 것이 못 된다는 데서, 아무런 관계도 없는 일에 나서서 참견함을 핀잔하는 말. "
사돈네 안방 같다,사돈네 안방처럼 감히 넘겨다보지 못할 만큼 어렵고 조심스러운 곳을 비유적으로 이르는 말. 
사돈네 제사에 가서 감 놓아라 배 놓아라 한다,남의 일에 공연히 간섭하고 나섬을 비유적으로 이르는 말. 
사돈도 이럴 사돈 다르고 저럴 사돈 다르다,같은 경우라도 사람에 따라 달리 대하여야 함을 비유적으로 이르는 말. 
사돈도 이럴 사돈 저럴 사돈 있다,같은 경우라도 사람에 따라 달리 대하여야 함을 비유적으로 이르는 말. 
사돈 밤 바래기,"사돈은 어려운 손님이므로 밤이 늦었다 하여 바래다주면 이번에는 저편에서 또 바래다주고 하다가 날이 밝는다는 뜻으로, 자꾸 반복하여 끝이 없음을 이르는 말. "
사돈 영감 제상 바라보듯,"직접적인 관계가 없는 사돈 영감의 제상을 덤덤히 바라보고 있듯 한다는 뜻으로, 별 관심 없이 멍청히 바라봄을 이르는 말. "
사돈은 부처님 팔촌만도 못하다,사돈간은 워낙 어려운 사이여서 먼 이웃만도 못하다는 말. 
사돈을 하려면 근본을 봐라,사돈을 정하려거든 우선 상대편의 가문이 어떤가를 보고서 하라는 말. 
사돈의 팔촌,남이나 다름없는 먼 친척. 
사돈이 말하는데 싸라기 엎지른 것까지 들춘다,"싸라기 몇 알 엎지른 대수롭지 않은 실수를 사돈 앞에서 들추어내어 남의 망신을 시킨다는 뜻으로, 그래서는 안 될 사이에 남의 결함을 시시콜콜 다 들추어내서 말함을 비난하여 이르는 말. "
사돈이 물에 빠졌나 웃기는 왜 웃어,별로 우습지도 아니한 일에 실없이 잘 웃는 사람을 핀잔하는 말. 
사돈집과 뒷간은 멀수록 좋다,사돈집 사이에는 말이 나돌기 쉽고 뒷간은 고약한 냄새가 나므로 둘 다 멀리 있을수록 좋음을 이르는 말. 
사돈집과 짐바리는 골라야 좋다,"짐바리는 실어서 한쪽으로 기울지 아니하도록 고르게 쌓아야 하듯이, 사돈집도 여러 모로 따져서 한쪽이 기울지 아니하는 비등한 집을 골라야 자식들의 행복을 위하여서나 발전을 위하여 좋은 것임을 비유적으로 이르는 말. "
사돈집 외 먹기도 각각,집집마다 가풍이 다름을 비유적으로 이르는 말. 
사돈집 잔치에 감 놓아라 배 놓아라 한다,남의 일에 공연히 간섭하고 나섬을 비유적으로 이르는 말. 
사또 걸어 등영고,"사또를 걸어 감영에 올라가 고한다는 뜻으로, 어림없고 승산이 전혀 없는 짓을 함을 이르는 말. "
사또님 말씀이야 다[늘] 옳습지,「1」아랫사람이 윗사람의 말을 빈정거리는 경우를 이르는 말. 「2」제 의견만 옳다고 우기는 사람에게 귀찮아져서 한 걸음 양보함을 이르는 말. 
사또 덕분에 나팔 분다,"사또와 동행한 덕분에 나팔 불고 요란히 맞아 주는 호화로운 대접을 받는다는 뜻으로, 남의 덕으로 당치도 아니한 행세를 하게 되거나 그런 대접을 받고 우쭐대는 모양을 비유적으로 이르는 말. "
사또 덕에 비장[비장 나리] 호강한다,"사또를 따라다니는 낮은 관원인 비장이 사또의 권세 덕분에 좋은 대우를 받는다는 뜻으로, 남에게 붙어서 덕을 봄을 이르는 말. "
사또 떠난 뒤에 나팔 분다,"사또 행차가 다 지나간 뒤에야 악대를 불러다 나팔을 불리고 북을 치게 한다는 뜻으로, 제때 안 하다가 뒤늦게 대책을 세우며 서두름을 핀잔하는 말. "
사또 밥상에 간장 종지 같다,「1」간장 종지는 밥상의 한가운데 놓는다는 데서 변변치 아니한 것이 한가운데 중요한 자리를 차지하고 있음을 비유적으로 이르는 말. 「2」요직에 있음을 비유적으로 이르는 말. 
사또 방석에 기름 종지 나앉는다,여럿이 모인 자리에 누군가가 불쑥 끼어들어 옴을 비유적으로 이르는 말. 
사또 상 같다,사또의 밥상처럼 떡 벌어지게 잘 차린 음식상을 이르는 말. 
사또 상의 장[꿀] 종지,「1」간장 종지는 밥상의 한가운데 놓는다는 데서 변변치 아니한 것이 한가운데 중요한 자리를 차지하고 있음을 비유적으로 이르는 말. 「2」요직에 있음을 비유적으로 이르는 말. 
사또 행차엔 비장이 죽어난다,"사또가 길을 떠나게 되니 비장은 그 준비를 갖추느라 눈코 뜰 사이 없이 바쁘다는 뜻으로, 윗사람이나 남의 일 때문에 고된 일을 하게 됨을 이르는 말. "
사람버리다,좋지 못한 사람으로 되게 하거나 사람을 못쓰게 만들다. 
사람잡다,「1」사람을 죽이다. 「2」사람을 극심한 곤경에 몰아넣다. 「3」사람의 마음을 황홀하게 하거나 녹여 주다. 
사람되다,도덕적으로나 인격적으로 사람으로서의 자질을 갖춘 인간이 되다. 
사람값에 가다,사람으로 쳐줄 만한 가치를 지니다. 
사람값에 들다,사람이라고 이를 만한 가치를 지니다. 
사람값에 들지 못하다,사람으로 쳐줄 만한 가치에서 크게 벗어나다. 
사람 같지 않다,사람으로서 마땅히 지녀야 할 품행이나 덕성이 없다. 
사람과 곡식은 가꾸기에 달렸다,곡식은 사람의 손이 많이 가고 부지런히 가꾸어야 잘되고 사람은 어려서부터 잘 가르치고 이끌어야 훌륭하게 된다는 말. 
사람과 그릇은 많을수록 좋다,사람의 노력이나 그릇은 많으면 많을수록 그만큼 쓸모가 있음을 이르는 말. 
사람과 그릇은 있으면 쓰고 없으면 못 쓴다,사람과 그릇은 없으면 못 쓰지만 있기만 하면 있는 만큼 다 쓸모가 있음을 이르는 말. 
사람과 산은 멀리서 보는 게 낫다,사람을 가까이 사귀면 멀리서 볼 때 안 보이던 결점이 다 드러나 실망하게 됨을 비유적으로 이르는 말. 
사람과 쪽박[그릇]은 있는 대로 쓴다[쓰인다],"살림을 하노라면 쓸모없어 보이는 쪽박이나 그릇도 있는 대로 다 쓴다는 뜻으로, 사람도 다 제 나름대로 쓸모가 있음을 비유적으로 이르는 말. "
사람 나고 돈 났지 돈 나고 사람 났나,"아무리 돈이 귀중하다 하여도 사람보다 더 귀중할 수는 없다는 뜻으로, 돈밖에 모르는 사람을 비난하여 이르는 말. "
사람도 늦바람이 무섭다,"늦게 불기 시작한 바람이 초가집 지붕마루에 얹은 용마름을 벗겨 갈 만큼 세다는 뜻으로, 사람도 늙은 후에 한번 바람이 나기 시작하면 걷잡을 수 없음을 비유적으로 이르는 말. "
사람마다 저 잘난 맛에 산다,남이야 어떻게 보든 사람은 다 자기가 잘났다는 긍지와 자존심이 있다는 것을 이르는 말. 
사람마다 한 가지 버릇은 있다,사람은 누구나 한두 가지의 좋지 못한 버릇이 있음을 이르는 말. 
사람 밥 빌어먹는 구멍은 삼천몇 가지,사람이 먹고살아 나가기 위한 생활 수단이 매우 다양함을 비유적으로 이르는 말. 
사람 살 곳은 골골이 있다,아무리 어려운 환경에서도 도와주는 사람은 다 있다는 것을 비유적으로 이르는 말. 
사람 살려,생명에 위험을 느낄 만큼 위급한 상황에 처하였을 때 외치는 소리. 
사람 세워 놓고 입관하겠다,"목숨이 살아 움직이는 사람을 관에 넣을 정도라는 뜻으로, 행동이나 말이 지나치게 혹독함을 비난하여 이르는 말. "
사람 속은 천 길 물속이라,사람의 속마음을 알기란 매우 힘듦을 비유적으로 이르는 말. 
사람 안 죽은 아랫목 없다,"사람 사는 집에서 사람 안 죽은 집이 거의 없다는 뜻으로, 알고 보면 어느 곳이나 험하고 궂은 일이 있었던 자리일 수 있음을 이르는 말. "
사람에 버릴 사람 없고 물건에 버릴 물건 없다,무엇이나 다 두어두면 저마다 쓸 때가 있음을 비유적으로 이르는 말. 
